4311,其他商服用地,盐城市,射阳县,射阳县城市投资发展有限责任公司,合德镇红旗路27-47-62号地块,40,协议,125.883,,2016,2016年9月,2016/9/5,492.5,1.65,812.625,射阳县城市投资发展有限责任公司,,,,,,,,,,,,,,2016/9/5,2016/9/5
4312,其他商服用地,盐城市,射阳县,射阳县城市投资发展有限责任公司,合德镇解放路189号27-164-208号地块,40,协议,521.3808,,2016,2016年9月,2016/9/5,2187,0.95,2077.65,射阳县城市投资发展有限责任公司,,,,,,,,,,,,,,2016/9/5,2016/9/5
4315,公共设施用地,盐城市,亭湖区,江苏盐城中波发射台项目,盐城市亭湖区新兴镇前营村一组、二组,,划拨,0,,2016,2016年9月,2016/9/2,18000,0.13,2340,盐城广播电视台,,,,,,,,,,,,,,2016/12/20,2018/12/20
4316,公共设施用地,盐城市,亭湖区,江苏盐城中波发射台项目（广播发射信号塔一）,盐城市亭湖区新兴镇前营村二组,,划拨,0,,2016,2016年9月,2016/9/2,670,0.13,87.1,盐城广播电视台,,,,,,,,,,,,,,2016/12/20,2017/12/20
4317,公共设施用地,盐城市,亭湖区,江苏盐城中波发射台项目（广播发射信号塔二）,盐城市亭湖区新兴镇前营村二组,,划拨,0,,2016,2016年9月,2016/9/2,670,0.13,87.1,盐城广播电视台,,,,,,,,,,,,,,2016/12/20,2017/12/20
4318,公共设施用地,盐城市,亭湖区,江苏盐城中波发射台项目（广播发射信号塔三）,盐城市亭湖区新兴镇前营村三组,,划拨,0,,2016,2016年9月,2016/9/2,670,0.13,87.1,盐城广播电视台,,,,,,,,,,,,,,2016/12/20,2017/12/20
4319,公共设施用地,盐城市,亭湖区,江苏盐城中波发射台项目（广播发射信号塔四）,盐城市亭湖区新兴镇前营村三组,,划拨,0,,2016,2016年9月,2016/9/2,670,0.13,87.1,盐城广播电视台,,,,,,,,,,,,,,2016/12/20,2017/12/20
4324,医卫慈善用地,盐城市,亭湖区,新建卫生院项目,盐城市亭湖区新兴镇新南居委会,,划拨,0,,2016,2016年9月,2016/9/1,10354,0.64,6626.56,盐城市亭湖区新兴镇卫生院,,,,,,,,,,,,,,2016/12/20,2018/12/20
4343,住宿餐饮用地,盐城市,大丰市,国网江苏省电力公司盐城市大丰区供电公司,大桥镇幸福路东侧、大港路北侧,40,挂牌,186,,2016,2016年8月,2016/8/26,3087,2,6174,国网江苏省电力公司盐城市大丰区供电公司,,,,,,,,,,,,,,2017/2/28,2019/2/28
4344,医卫慈善用地,盐城市,射阳县,射阳县养老中心,射阳县福利院东侧,,划拨,0,,2016,2016年8月,2016/8/26,55671.6,1.6,89074.56,射阳县国有资产投资有限责任公司,,,,,,,,,,,,,,2016/11/26,2018/11/25
4345,科教用地,盐城市,射阳县,建设射阳县第三中学,合德镇双龙居委会,,划拨,0,,2016,2016年8月,2016/8/26,73124,1,73124,射阳县城市建设发展集团有限公司,,,,,,,,,,,,,,2016/10/14,2018/10/13
4354,科教用地,盐城市,东台市,头灶镇曹丿小学操场,头灶镇曹丿小学内,,划拨,0,,2016,2016年8月,2016/8/24,5645,1,5645,东台市头灶镇人民政府,,,,,,,,,,,,,,2016/12/9,2017/6/9
4358,机关团体用地,盐城市,城南新区,新河街道新墩社区居民服务中心,盐城市城南新区新河街道新墩社区居委会,,划拨,0,,2016,2016年8月,2016/8/22,2467,0.73,1800.91,盐城市城南新区新河街道办事处,,,,,,,,,,,,,,2017/4/20,2020/4/20
4359,医卫慈善用地,盐城市,大丰市,同仁医院建设项目,大丰区大中镇春柳路西侧、晨风路南侧,,划拨,0,,2016,2016年8月,2016/8/22,60607,1.5,90910.5,盐城市大丰同仁医院,,,,,,,,,,,,,,2017/1/20,2019/1/20
4360,公共设施用地,盐城市,亭湖区,江苏黄海区域海洋气象预警中心（盐城市气象灾害预警应急中心）项目,江苏盐城亭湖经济开发区南林社区居民委员会一组,,划拨,0,,2016,2016年8月,2016/8/22,9753,0.84,8192.52,盐城市气象局,,,,,,,,,,,,,,2016/11/25,2018/11/25
4363,公共设施用地,盐城市,经济技术开发区,新奥储配站扩建项目,盐城经济技术开发区新城街道蔡尖社区居委会,50,挂牌,16.6089,,2016,2016年8月,2016/8/18,719,0.5,359.5,盐城新城新奥燃气有限公司,,,,,,,,,,,,,,2016/12/18,2018/12/18
4364,公共设施用地,盐城市,经济技术开发区,新奥燃气储配站扩建项目,盐城经济技术开发区新城街道蔡尖社区居委会,50,挂牌,142.9197,,2016,2016年8月,2016/8/18,6187,0.5,3093.5,盐城新城新奥燃气有限公司,,,,,,,,,,,,,,2016/12/18,2018/12/18
4368,科教用地,盐城市,盐都区,盐城中咏投资发展有限公司,盐都区盐龙街道办事处古亭居委会四、五组,50,挂牌,18412.52,,2016,2016年8月,2016/8/16,173050,1.2,207660,盐城中咏投资发展有限公司,,,,,,,,,,,,,,2017/12/15,2020/12/14
4370,公共设施用地,盐城市,东台市,东台市唐洋镇文化广电服务中心,东台市唐洋镇安建村二组,,划拨,0,,2016,2016年8月,2016/8/12,4304,1.2,5164.8,唐洋镇人民政府,,,,,,,,,,,,,,2017/3/12,2017/9/12
4371,科教用地,盐城市,东台市,东台市第一小学开发区分校,江苏东台经济开发区经三路东侧,,划拨,0,,2016,2016年8月,2016/8/11,17004,0.48,8161.92,东台市第一小学,,,,,,,,,,,,,,2017/4/11,2018/4/11
4372,公共设施用地,盐城市,东台市,南沈灶派出所业务用房,东台市南沈灶镇镇中路南侧,,划拨,0,,2016,2016年8月,2016/8/10,3819,1,3819,东台市公安局,,,,,,,,,,,,,,2017/4/10,2018/4/10
4373,科教用地,盐城市,滨海县,滨海县教育局,滨海县经济开发区西坎村、海港大道北侧，明达北路南侧,,划拨,0,,2016,2016年8月,2016/8/10,13273.4,0.7,9291.38,滨海县教育局,,,,,,,,,,,,,,2016/10/10,2018/10/10
4375,其他商服用地,盐城市,盐都区,盐城市大纵湖湖区资源开发有限公司,滨湖街道办事处平湖居委会,40,挂牌,646.5625,,2016,2016年8月,2016/8/8,10345,1.2,12414,盐城市大纵湖湖区资源开发有限公司,,,,,,,,,,,,,,2017/12/7,2020/12/6
4376,其他商服用地,盐城市,盐都区,盐城市双新建设投资有限公司,大纵湖镇三官村,40,挂牌,1992.635,,2016,2016年8月,2016/8/8,21542,1.2,25850.4,盐城市双新建设投资有限公司,,,,,,,,,,,,,,2017/12/7,2020/11/6
4377,其他商服用地,盐城市,盐都区,盐城市双新建设投资有限公司,大纵湖镇三官村,40,挂牌,3246.3912,,2016,2016年8月,2016/8/8,40378,1.2,48453.6,盐城市双新建设投资有限公司,,,,,,,,,,,,,,2017/12/7,2020/12/6
4378,其他商服用地,盐城市,盐都区,盐城市大纵湖湖区资源开发有限公司,滨湖街道办事处平湖居委会,40,挂牌,1653.75,,2016,2016年8月,2016/8/8,26460,1.2,31752,盐城市大纵湖湖区资源开发有限公司,,,,,,,,,,,,,,2017/12/7,2020/12/6
4380,其他商服用地,盐城市,东台市,中国石化销售有限公司江苏盐城石油分公司,开发区北绕城南侧、九里沟东侧,40,挂牌,429.355,,2016,2016年8月,2016/8/5,3994,0.3,1198.2,中国石化销售有限公司江苏盐城石油分公司,,,,,,,,,,,,,,2017/5/5,2017/11/5
4387,其他商服用地,盐城市,东台市,东台黄海森林投资发展有限公司,黄海森林公园海林路北侧地块二,40,挂牌,145.1208,,2016,2016年8月,2016/8/3,4397.6,1.6,7036.16,东台黄海森林投资发展有限公司,,,,,,,,,,,,,,2017/5/3,2019/5/3
4388,其他商服用地,盐城市,东台市,东台黄海森林投资发展有限公司,黄海森林公园海林路北侧地块一,40,挂牌,135.3858,,2016,2016年8月,2016/8/3,4102.6,1.6,6564.16,东台黄海森林投资发展有限公司,,,,,,,,,,,,,,2017/5/3,2019/5/3
4397,公共设施用地,盐城市,射阳县,绿化,射阳县特庸镇码头居委会,,划拨,0,,2016,2016年8月,2016/8/1,135.8,1,135.8,射阳县特庸镇码头居委会,,,,,,,,,,,,,,2017/1/31,2018/1/30
4410,商务金融用地,盐城市,盐都区,盐城市城镇化建设投资有限公司,盐城市盐都区海洋路北、达信路西,40,挂牌,30257.6625,,2016,2016年7月,2016/7/28,103445,2.5,258612.5,盐城市城镇化建设投资有限公司,,,,,,,,,,,,,,2017/7/15,2020/7/14
4411,公共设施用地,盐城市,盐都区,冈中街道污水处理厂建设工程项目,盐城市盐都区大冈镇瓦屋村六组,,划拨,0,,2016,2016年7月,2016/7/28,13853,0.12,1662.36,盐城市盐都有限公司,,,,,,,,,,,,,,2016/11/28,2018/11/27
4414,医卫慈善用地,盐城市,大丰市,小海中心卫生院,大丰区小海镇兴海路南侧,,划拨,0,,2016,2016年7月,2016/7/27,17595,0.8,14076,盐城市大丰区小海镇人民政府,,,,,,,,,,,,,,2016/11/30,2017/11/30
4415,公共设施用地,盐城市,盐都区,新建仓头村卫生服务站项目,盐都区张庄街道办事处仓头村二组,,划拨,0,,2016,2016年7月,2016/7/26,740,0.25,185,盐城市盐都区张庄街道办事处,,,,,,,,,,,,,,2016/10/26,2017/11/25
4416,公共设施用地,盐城市,盐都区,新建郑通村卫生服务站项目,盐都区张庄街道办事处郑通村七组,,划拨,0,,2016,2016年7月,2016/7/26,622,0.3,186.6,盐城市盐都区张庄街道办事处,,,,,,,,,,,,,,2016/11/26,2017/11/25
4421,公共设施用地,盐城市,城南新区,亭湖区饮用水安全工程（城东水厂原水前期处理工程）,盐城市城南新区伍佑街道办事处构港村一、六组,,划拨,0,,2016,2016年7月,2016/7/25,314578,0.02,6291.56,盐城市市政公用投资有限公司,,,,,,,,,,,,,,2017/3/23,2020/3/23
4429,公共设施用地,盐城市,经济技术开发区,新建农贸市场项目,盐城经济技术开发区步凤镇伍龙居委会四组,,划拨,0,,2016,2016年7月,2016/7/22,11062,1,11062,盐城经济技术开发区步凤镇人民政府,,,,,,,,,,,,,,2016/11/22,2018/11/22
4431,公共设施用地,盐城市,射阳县,建设干线公路养护应急处置基地机械设施存放场,兴桥镇公路管理站西侧,,划拨,0,,2016,2016年7月,2016/7/21,3371,1,3371,江苏省射阳县公路管理站,,,,,,,,,,,,,,2016/9/21,2018/9/20
4432,商务金融用地,盐城市,亭湖区,盐城市市委党校南校区,解放南路123号,40,协议,1068.48,,2016,2016年7月,2016/7/20,2195.8,1,2195.8,盐城市国有资产投资集团有限公司,,,,,,,,,,,,,,2017/3/20,2019/3/20
4433,其他商服用地,盐城市,大丰市,江苏高欣置业有限公司,高新区裕丰路东侧、幸福路景观带北侧,40,挂牌,2776,,2016,2016年7月,2016/7/19,28318,1,28318,江苏高欣置业有限公司,,,,,,,,,,,,,,2017/1/21,2020/1/21
4434,其他商服用地,盐城市,大丰市,盐城市大丰区华丰旅游实业发展有限公司,服务业集聚区西郊生态公园内,40,挂牌,945,,2016,2016年7月,2016/7/19,10492,1,10492,盐城市大丰区华丰旅游实业发展有限公司,,,,,,,,,,,,,,2017/1/21,2018/1/21
4435,其他商服用地,盐城市,大丰市,大丰市麋鹿早酥梨专业合作社,大中镇恒北村四组,40,挂牌,373,,2016,2016年7月,2016/7/19,6776,1,6776,大丰市麋鹿早酥梨专业合作社,,,,,,,,,,,,,,2017/1/21,2018/1/21
4436,其他商服用地,盐城市,大丰市,江苏盐丰现代农业发展有限公司,大桥镇大桥村二组,40,挂牌,65,,2016,2016年7月,2016/7/19,1440,2,2880,江苏盐丰现代农业发展有限公司,,,,,,,,,,,,,,2017/1/20,2018/1/20
4437,其他商服用地,盐城市,大丰市,卞正荣,大桥镇大桥村二组,40,挂牌,378,,2016,2016年7月,2016/7/19,8380,1.5,12570,卞正荣,,,,,,,,,,,,,,2017/1/21,2019/1/21
4438,其他商服用地,盐城市,大丰市,盐城市大丰区姜尚旅游发展有限公司,草庙镇东灶村四组,40,挂牌,157,,2016,2016年7月,2016/7/19,3473,1.2,4167.6,盐城市大丰区姜尚旅游发展有限公司,,,,,,,,,,,,,,2017/1/21,2018/1/21
4439,公共设施用地,盐城市,阜宁县,光明派出所业务用房,阜城街道办事处崔湾村阜城国土分局南侧,,划拨,0,,2016,2016年7月,2016/7/19,2496.7,1,2496.7,阜宁县公安局,,,,,,,,,,,,,,2016/8/29,2018/8/29
4441,批发零售用地,盐城市,亭湖区,盐城大世界全球家居生活广场有限公司,盐城市亭湖区经济开发区南林社区居民委员会三组、北林社区居民委员会九组,40,挂牌,5662.8,,2016,2016年7月,2016/7/18,34320,1.8,61776,盐城大世界全球家居生活广场有限公司,,,,,,,,,,,,,,2017/5/18,2020/5/18
4443,住宿餐饮用地,盐城市,大丰市,大丰市丰鹿建材有限公司,开发区黄海西路南侧,40,协议,260.39,,2016,2016年7月,2016/7/15,2378,1.74,4137.72,大丰市丰鹿建材有限公司,,,,,,,,,,,,,,2016/7/15,2016/7/15
4444,文体娱乐用地,盐城市,大丰市,江苏权健科技发展有限公司,开发区反修河南侧,50,挂牌,2824,,2016,2016年7月,2016/7/15,125499,0.5,62749.5,江苏权健科技发展有限公司,,,,,,,,,,,,,,2017/1/17,2019/1/17
4450,科教用地,盐城市,建湖县,建湖县森达实验学校实施改扩建工程,近湖街道镇南村向阳组,,划拨,0,,2016,2016年7月,2016/7/14,21772,1,21772,建湖县森达实验学校,,,,,,,,,,,,,,2016/9/20,2018/9/19
4451,文体娱乐用地,盐城市,阜宁县,文体公园地块一,北京路南、南京路东,,划拨,0,,2016,2016年7月,2016/7/13,13572.71,1.5,20359.065,阜宁县建设投资有限公司,,,,,,,,,,,,,,2016/8/3,2018/8/3
4452,文体娱乐用地,盐城市,阜宁县,文体公园地块三,南京路东、苏州路北,,划拨,0,,2016,2016年7月,2016/7/13,7197.23,1.2,8636.676,阜宁县建设投资有限公司,,,,,,,,,,,,,,2016/8/3,2018/8/3
4453,文体娱乐用地,盐城市,阜宁县,文体公园地块四,南京路东、苏州路北,,划拨,0,,2016,2016年7月,2016/7/13,920.39,0.3,276.117,阜宁县建设投资有限公司,,,,,,,,,,,,,,2016/8/3,2018/8/3
4454,文体娱乐用地,盐城市,阜宁县,文体公园地块二,北京路南、厦门路西,,划拨,0,,2016,2016年7月,2016/7/13,17670.54,1.7,30039.918,阜宁县建设投资有限公司,,,,,,,,,,,,,,2016/8/3,2018/8/3
4455,文体娱乐用地,盐城市,阜宁县,文体公园地块五,苏州路北、厦门路西,,划拨,0,,2016,2016年7月,2016/7/13,20112.12,1.2,24134.544,阜宁县建设投资有限公司,,,,,,,,,,,,,,2016/8/3,2018/8/3
4469,科教用地,盐城市,亭湖区,盐城市新洋第二实验学校项目,盐城市亭湖区新洋街道办事处龙桥村民委员会四、五组,,划拨,0,,2016,2016年7月,2016/7/11,40618,0.69,28026.42,盐城小学,,,,,,,,,,,,,,2016/9/20,2019/9/20
4471,其他商服用地,盐城市,响水县,响水县新港建设发展有限公司,沿海经济区境内,40,挂牌,2995,,2016,2016年7月,2016/7/8,66552,3.5,232932,响水县新港建设发展有限公司,,,,,,,,,,,,,,2016/12/30,2019/12/30
4472,其他商服用地,盐城市,响水县,响水县新港建设发展有限公司,沿海经济区境内,40,挂牌,2984,,2016,2016年7月,2016/7/8,66289,3.5,232011.5,响水县新港建设发展有限公司,,,,,,,,,,,,,,2016/12/30,2019/12/30
4473,其他商服用地,盐城市,响水县,响水县新港建设发展有限公司,沿海经济区境内,40,挂牌,2990,,2016,2016年7月,2016/7/8,66442,3.5,232547,响水县新港建设发展有限公司,,,,,,,,,,,,,,2016/12/30,2019/12/30
4474,其他商服用地,盐城市,响水县,响水县新港建设发展有限公司,沿海经济区境内,40,挂牌,2160,,2016,2016年7月,2016/7/8,48000,3.5,168000,响水县新港建设发展有限公司,,,,,,,,,,,,,,2016/12/30,2019/12/30
4475,其他商服用地,盐城市,响水县,响水县新港建设发展有限公司,沿海经济区境内,40,挂牌,3018,,2016,2016年7月,2016/7/8,67046,3.5,234661,响水县新港建设发展有限公司,,,,,,,,,,,,,,2016/12/30,2019/12/30
4476,其他商服用地,盐城市,响水县,响水县新城建设发展有限公司,沿海经济区境内,40,挂牌,2187,,2016,2016年7月,2016/7/8,48584,3.5,170044,响水县新港建设发展有限公司,,,,,,,,,,,,,,2016/12/30,2019/12/30
4477,其他商服用地,盐城市,响水县,响水县新城建设发展有限公司,沿海经济区境内,40,挂牌,2963,,2016,2016年7月,2016/7/8,65840,3.5,230440,响水县新港建设发展有限公司,,,,,,,,,,,,,,2016/12/30,2019/12/30
4478,其他商服用地,盐城市,响水县,响水县新城建设发展有限公司,沿海经济区境内,40,挂牌,2535,,2016,2016年7月,2016/7/8,56316,3.5,197106,响水县新港建设发展有限公司,,,,,,,,,,,,,,2016/12/30,2019/12/30
4479,其他商服用地,盐城市,响水县,响水县新城建设发展有限公司,沿海经济区境内,40,挂牌,3043,,2016,2016年7月,2016/7/8,67604,3.5,236614,响水县新港建设发展有限公司,,,,,,,,,,,,,,2016/12/30,2019/12/30
4480,其他商服用地,盐城市,响水县,响水县新城建设发展有限公司,沿海经济区境内,40,挂牌,2975,,2016,2016年7月,2016/7/8,66104,3.5,231364,响水县新港建设发展有限公司,,,,,,,,,,,,,,2016/12/30,2019/12/30
4484,其他商服用地,盐城市,响水县,响水县新港建设发展有限公司,沿海经济区境内,40,挂牌,2995,,2016,2016年7月,2016/7/8,66544,3.5,232904,响水县新港建设发展有限公司,,,,,,,,,,,,,,2016/12/30,2019/12/30
4485,其他商服用地,盐城市,响水县,响水县新港建设发展有限公司,沿海经济区内,40,挂牌,3029,,2016,2016年7月,2016/7/8,67301,3.5,235553.5,响水县新港建设发展有限公司,,,,,,,,,,,,,,2016/12/30,2019/12/30
4486,其他商服用地,盐城市,响水县,响水县新港建设发展有限公司,沿海经济区境内,40,挂牌,3048,,2016,2016年7月,2016/7/8,67713,3.5,236995.5,响水县新港建设发展有限公司,,,,,,,,,,,,,,2016/12/30,2019/12/30
4491,医卫慈善用地,盐城市,射阳县,射阳县暖阳老年公寓,临海镇临坍路北侧、陈李线西侧,,划拨,0,,2016,2016年7月,2016/7/4,4211,1.6,6737.6,射阳县暖阳老年公寓,,,,,,,,,,,,,,2016/10/3,2018/10/2
4492,公共设施用地,盐城市,东台市,6MW光伏电站项目,东台沿海经济区梁南垦区,,划拨,0,,2016,2016年7月,2016/7/1,264,1,264,东台沿海苏阳达光伏发电有限公司,,,,,,,,,,,,,,2016/8/20,2016/12/20
4496,其他商服用地,盐城市,大丰市,盐城市大丰大中农村集体资产经营管理有限公司,大中镇恒北村六组,40,挂牌,526,,2016,2016年6月,2016/6/28,7551,1.2,9061.2,盐城市大丰大中农村集体资产经营管理有限公司,,,,,,,,,,,,,,2016/12/30,2018/12/30
4497,公共设施用地,盐城市,大丰市,党群服务中心,大丰区小海镇工业园区,,划拨,0,,2016,2016年6月,2016/6/27,1868,1.2,2241.6,盐城市大丰区小海镇海团村村民委员会,,,,,,,,,,,,,,2016/11/15,2017/11/15
4507,公共设施用地,盐城市,阜宁县,江苏省电力公司阜宁县供电公司供电生产房,阜宁县吴滩街道办事处北讯村二组,,划拨,0,,2016,2016年6月,2016/6/22,2666.7,0.6,1600.02,江苏省电力公司阜宁县供电公司,,,,,,,,,,,,,,2016/7/14,2017/7/14
4509,其他商服用地,盐城市,盐都区,盐城市权润建设投资有限公司,秦南镇砖桥居委会、秦北村,50,挂牌,667.2135,,2016,2016年6月,2016/6/21,8565,1.2,10278,盐城市权润建设投资有限公司,,,,,,,,,,,,,,2017/6/20,2019/6/20
4510,批发零售用地,盐城市,盐都区,盐城市盐都区医疗产业园投资有限公司,学富镇时杨居委会,40,挂牌,411.3756,,2016,2016年6月,2016/6/21,5988,2,11976,盐城市盐都区医疗产业园投资有限公司,,,,,,,,,,,,,,2017/6/20,2019/6/20
4511,其他商服用地,盐城市,盐都区,盐城咏创建设发展有限公司,盐龙街道办事处秦川路东、彩虹路南,40,挂牌,4285.07,,2016,2016年6月,2016/6/21,23740,3.5,83090,盐城咏创建设发展有限公司,,,,,,,,,,,,,,2017/6/20,2020/6/20
4512,其他商服用地,盐城市,盐都区,盐城咏创建设发展有限公司,盐龙街道办事处振兴路西、彩虹路南,40,挂牌,1906.6215,,2016,2016年6月,2016/6/21,10563,3.5,36970.5,盐城咏创建设发展有限公司,,,,,,,,,,,,,,2017/6/20,2020/6/20
4513,其他商服用地,盐城市,盐都区,盐城咏创建设发展有限公司,盐龙街道办事处彩虹路北、马中河西,40,挂牌,3703.499,,2016,2016年6月,2016/6/21,20518,3.5,71813,盐城咏创建设发展有限公司,,,,,,,,,,,,,,2017/6/21,2020/6/20
4514,其他商服用地,盐城市,盐都区,盐城咏创建设发展有限公司,盐龙街道办事处益民居委会,40,挂牌,5852.7528,,2016,2016年6月,2016/6/21,41333,1.2,49599.6,盐城咏创建设发展有限公司,,,,,,,,,,,,,,2017/6/21,2020/6/20
4515,医卫慈善用地,盐城市,盐都区,盐城市盐都区国有资产投资有限公司,盐龙街道办事处益民居委会,40,挂牌,1680.489,,2016,2016年6月,2016/6/21,18366,1.8,33058.8,盐城市盐都区国有资产投资有限公司,,,,,,,,,,,,,,2017/6/21,2020/6/20
4517,其他商服用地,盐城市,滨海县,滨海海滨投资开发有限公司,滨海县西湖路西侧，育才西路北侧,70,挂牌,32587.938,,2016,2016年6月,2016/6/21,166605,2.5,416512.5,滨海海滨投资开发有限公司,,,,,,,,,,,,,,2016/8/21,2018/8/21
4518,其他商服用地,盐城市,阜宁县,阜宁县新阜宁液化气有限公司,香港路北、施陈路西地块,40,挂牌,1697,,2016,2016年6月,2016/6/20,11159.15,0.3,3347.745,阜宁县新阜宁液化气有限公司,,,,,,,,,,,,,,2016/9/12,2018/9/12
4522,科教用地,盐城市,阜宁县,益林镇育苗幼儿园,益林镇建新西路,,划拨,0,,2016,2016年6月,2016/6/20,4761.24,1,4761.24,阜宁县益林镇育苗幼儿园,,,,,,,,,,,,,,2016/7/10,2017/7/10
4526,批发零售用地,盐城市,阜宁县,中国石化销售有限公司江苏盐城石油分公司,329省道北地块,40,挂牌,663,,2016,2016年6月,2016/6/17,5534.52,0.2,1106.904,中国石化销售有限公司江苏盐城石油分公司,,,,,,,,,,,,,,2016/9/7,2018/9/7
4532,商务金融用地,盐城市,亭湖区,盐城金牛置业有限公司,盐城市亭湖区亭湖新区新丰经济合作社七组,40,挂牌,3044.1565,,2016,2016年6月,2016/6/14,14959,1.8,26926.2,盐城金牛置业有限公司,,,,,,,,,,,,,,2017/4/14,2020/4/14
4533,商务金融用地,盐城市,亭湖区,盐城金牛置业有限公司,盐城市亭湖区亭湖新区新丰经济合作社七组,40,挂牌,3007.816,,2016,2016年6月,2016/6/14,15346,1.8,27622.8,盐城金牛置业有限公司,,,,,,,,,,,,,,2017/4/14,2020/4/14
4543,科教用地,盐城市,经济技术开发区,异地新建步凤小学新校区项目,盐城经济技术开发区步凤镇伍龙居委会,,划拨,0,,2016,2016年6月,2016/6/13,52404,0.4,20961.6,盐城经济技术开发区步凤镇人民政府,,,,,,,,,,,,,,2016/8/13,2018/8/12
4545,公共设施用地,盐城市,盐都区,盐城高新区消防站项目,盐都区盐龙街道办事处黄刘居委会三组,,划拨,0,,2016,2016年6月,2016/6/12,9801,0.46,4508.46,盐城市盐都区人民政府盐龙街道办事处,,,,,,,,,,,,,,2016/10/12,2018/10/11
4563,科教用地,盐城市,东台市,华东沿海防护林生态系统国家生态定位观测研究站,东台市林场二区,,划拨,0,,2016,2016年6月,2016/6/6,6863,0.3,2058.9,中国林业科学研究院亚热带林业研究所,,,,,,,,,,,,,,2016/9/20,2017/3/20
4579,机关团体用地,盐城市,东台市,东台市新街镇林业站,新街镇街北村,,划拨,0,,2016,2016年6月,2016/6/1,1071,0.59,631.89,东台市新街镇林业站,,,,,,,,,,,,,,2016/7/20,2016/9/20
4585,公共设施用地,盐城市,响水县,响水长江风力发电有限公司,陈家港镇海岸线内，三圩盐场和灌东盐场,50,协议,0.31,,2016,2016年5月,2016/5/31,28,1,28,响水长江风力发电有限公司,,,,,,,,,,,,,,2016/11/30,2017/11/30
4586,公共设施用地,盐城市,响水县,响水县长江风力发电有限公司,陈家港镇海岸线内，三圩盐场和灌东盐场,50,协议,0.31,,2016,2016年5月,2016/5/31,28,1,28,响水长江风力发电有限公司,,,,,,,,,,,,,,2016/11/30,2017/11/30
4587,公共设施用地,盐城市,响水县,响水长江风力发电有限公司,陈家港镇海岸线内，三圩盐场和灌东盐场,50,协议,0.31,,2016,2016年5月,2016/5/31,28,1,28,响水长江风力发电有限公司,,,,,,,,,,,,,,2016/11/30,2017/11/30
4588,公共设施用地,盐城市,响水县,响水长江风力发电有限公司,陈家港镇海岸线内，三圩盐场和灌东盐场,50,协议,0.31,,2016,2016年5月,2016/5/31,28,1,28,响水长江风力发电有限公司,,,,,,,,,,,,,,2016/11/30,2017/11/30
4589,公共设施用地,盐城市,响水县,响水长江风力发电有限公司,陈家港镇海岸线内，三圩盐场和灌东盐场,50,协议,0.31,,2016,2016年5月,2016/5/31,28,1,28,响水长江风力发电有限公司,,,,,,,,,,,,,,2016/11/30,2017/11/30
4590,公共设施用地,盐城市,响水县,响水长江风力发电有限公司,陈家港镇海岸线内，三圩盐场和灌东盐场,50,协议,0.31,,2016,2016年5月,2016/5/31,28,1,28,响水长江风力发电有限公司,,,,,,,,,,,,,,2016/11/30,2017/11/30
4591,公共设施用地,盐城市,响水县,响水长江风力发电有限公司,陈家港镇海岸线内，三圩盐场和灌东盐场,50,协议,0.31,,2016,2016年5月,2016/5/31,28,1,28,响水长江风力发电有限公司,,,,,,,,,,,,,,2016/11/30,2017/11/30
4592,公共设施用地,盐城市,响水县,响水长江风力发电有限公司,陈家港镇海岸线内，三圩盐场和灌东盐场,50,协议,0.31,,2016,2016年5月,2016/5/31,28,1,28,响水长江风力发电有限公司,,,,,,,,,,,,,,2016/11/30,2017/11/30
4593,公共设施用地,盐城市,响水县,响水长江风力发电有限公司,陈家港镇海岸线内，三圩盐场和灌东盐场,50,协议,0.31,,2016,2016年5月,2016/5/31,28,1,28,响水长江风力发电有限公司,,,,,,,,,,,,,,2016/11/30,2017/11/30
4594,公共设施用地,盐城市,响水县,响水长江风力发电有限公司,陈家港镇海岸线内，三圩盐场和灌东盐场,50,协议,0.31,,2016,2016年5月,2016/5/31,28,1,28,响水长江风力发电有限公司,,,,,,,,,,,,,,2016/11/30,2017/11/30
4595,公共设施用地,盐城市,响水县,响水长江风力发电有限公司,陈家港镇海岸线内，三圩盐场和灌东盐场,50,协议,0.31,,2016,2016年5月,2016/5/31,28,1,28,响水长江风力发电有限公司,,,,,,,,,,,,,,2016/11/30,2017/11/30
