3325,医卫慈善用地,盐城市,经济技术开发区,盐城东方友谊医院项目,盐城经济技术开发区新城街道阳光社区居委会、新林社区居委会,,划拨,0,,2017,2017年6月,2017/6/16,64550,1.27,81978.5,盐城市妇幼保健医院,,,,,,,,,,,,,,2017/11/16,2019/11/16
3356,其他商服用地,盐城市,射阳县,盐城碧桂园房地产开发有限公司,射阳县五洲国际北侧地块,40,挂牌,30200,,2017,2017年6月,2017/6/2,76781.4,3,230344.2,盐城碧桂园房地产开发有限公司,,,,,,,,,,,,,,2018/4/2,2021/4/2
3364,公共设施用地,盐城市,响水县,110KV金化变电所,响陈路北侧、疏港路西侧（化工园区内）,,划拨,0,,2017,2017年5月,2017/5/31,6400,1,6400,国网江苏省电力公司响水县供电公司,,,,,,,,,,,,,,2017/5/31,2018/5/31
3365,其他商服用地,盐城市,东台市,东台市广商房地产开发有限公司,时堰镇嵇东村一组,40,挂牌,164.106,,2017,2017年5月,2017/5/30,3039,1,3039,东台市广商房地产开发有限公司,,,,,,,,,,,,,,2018/3/1,2019/3/1
3373,商务金融用地,盐城市,城南新区,盐城市城市建设投资集团有限公司,盐城市城南新区新河街道办事处新怡社区居委会（世纪大道南、新园路西侧）,40,挂牌,15901.235,,2017,2017年5月,2017/5/25,8657,0.8,6925.6,盐城市城市建设投资集团有限公司,,,,,,,,,,,,,,2018/3/26,2021/3/26
3374,其他商服用地,盐城市,滨海县,滨海县水务发展有限公司,滨海县港城路西侧、县公安局交巡警大队南侧,40,挂牌,3068.2316,,2017,2017年5月,2017/5/25,13311.2,2,26622.4,滨海县水务发展有限公司,,,,,,,,,,,,,,2017/7/25,2019/7/25
3375,军事设施用地,盐城市,大丰市,机动中队营房建设项目,大丰区三龙镇斗龙港村四组，渔村大道西侧,,划拨,0,,2017,2017年5月,2017/5/25,42000,2,84000,中国人民武装警察部队盐城市边防支队,,,,,,,,,,,,,,2017/11/18,2019/11/18
3376,机关团体用地,盐城市,东台市,新街国土大楼平移,新街镇新街村六组,,划拨,0,,2017,2017年5月,2017/5/23,1489,1.08,1608.12,东台市国土资源局,,,,,,,,,,,,,,2018/1/24,2019/1/24
3378,其他商服用地,盐城市,滨海县,江苏滨海农村商业银行股份有限公司,滨海县陈涛镇郭集小街东侧,40,挂牌,94.0268,,2017,2017年5月,2017/5/23,664.5,2.7,1794.15,江苏滨海农村商业银行股份有限公司,,,,,,,,,,,,,,2017/7/23,2019/7/23
3379,科教用地,盐城市,经济技术开发区,新城中心小学项目,盐城经济技术开发区三洼村,,划拨,0,,2017,2017年5月,2017/5/23,69042,0.7,48329.4,盐城经济技术开发区社会事业局,,,,,,,,,,,,,,2017/10/23,2019/11/23
3380,其他商服用地,盐城市,滨海县,滨海县城镇建设发展有限公司,滨海县明达路北侧、仁和中路西侧,40,挂牌,2824.6361,,2017,2017年5月,2017/5/22,17957,1.3,23344.1,滨海县城镇建设发展有限公司,,,,,,,,,,,,,,2017/7/22,2019/7/22
3381,公共设施用地,盐城市,盐都区,建设环境空气自动监测站项目,盐城市盐都区郭猛镇护陇居委会二组,,划拨,0,,2017,2017年5月,2017/5/19,2057,0.4,822.8,盐城市盐都区环境保护局,,,,,,,,,,,,,,2017/9/19,2018/9/18
3383,公共设施用地,盐城市,东台市,安丰电子信息产业园污水处理厂,东台市安丰镇红安村,,划拨,0,,2017,2017年5月,2017/5/18,8102,1,8102,东台市安丰工业园区开发有限公司,,,,,,,,,,,,,,2018/1/18,2020/1/18
3385,医卫慈善用地,盐城市,东台市,东台市妇幼保健院,市经济开发区红兰路东侧、庆丰路南侧,,划拨,0,,2017,2017年5月,2017/5/18,14515,1.32,19159.8,东台市妇幼保健院,,,,,,,,,,,,,,2018/1/18,2019/1/18
3394,其他商服用地,盐城市,滨海县,滨海县城镇建设发展有限公司,滨海县明达路南侧、景湖路西侧,40,挂牌,1065.3385,,2017,2017年5月,2017/5/16,6995,1.3,9093.5,滨海县城镇建设发展有限公司,,,,,,,,,,,,,,2017/7/16,2019/7/16
3396,住宿餐饮用地,盐城市,大丰市,盐城市大丰润聚商贸有限公司,刘庄镇204国道西侧,40,挂牌,292,,2017,2017年5月,2017/5/15,3738,1.2,4485.6,盐城市大丰润聚商贸有限公司,,,,,,,,,,,,,,2017/11/17,2019/11/17
3397,科教用地,盐城市,亭湖区,新建活动中心项目,盐城市亭湖经济开发区新民合作社五组、六组,,划拨,0,,2017,2017年5月,2017/5/15,9863,0.51,5030.13,盐城亭湖新区实验学校,,,,,,,,,,,,,,2017/8/15,2018/8/15
3399,公共设施用地,盐城市,东台市,东台市三仓镇敬老院,三仓镇新桥居委会二组,,划拨,16.8328,,2017,2017年5月,2017/5/15,16470,0.31,5105.7,东台市三仓镇人民政府,,,,,,,,,,,,,,2017/11/20,2019/12/20
3406,公共设施用地,盐城市,东台市,东台市健达气体有限公司,港镇花舍村四组,50,挂牌,67.8483,,2017,2017年5月,2017/5/8,2512.9,0.2,502.58,东台市健达气体有限公司,,,,,,,,,,,,,,2018/2/8,2019/2/8
3408,商务金融用地,盐城市,经济技术开发区,郑书生商业项目,盐城经济技术开发区步凤镇曙光居委会,40,挂牌,276.3045,,2017,2017年5月,2017/5/5,3165,1.2,3798,郑书生,,,,,,,,,,,,,,2017/10/5,2019/10/5
3410,公共设施用地,盐城市,响水县,张集派出所技术业务用房改建项目,张集中心社区小佃路北侧，原张集派出所院内,,划拨,0,,2017,2017年5月,2017/5/3,3023,1,3023,响水县公安局,,,,,,,,,,,,,,2017/5/3,2018/5/3
3415,公共设施用地,盐城市,射阳县,江苏盐阜银宝新能源有限公司,江苏盐阜银宝新源有限公司100MW风电场项目38#,50,挂牌,4.8422,,2017,2017年5月,2017/5/2,329.4,1,329.4,江苏盐阜银宝新能源有限公司,,,,,,,,,,,,,,2018/1/4,2020/1/3
3416,公共设施用地,盐城市,射阳县,江苏盐阜银宝新能源有限公司,江苏盐阜银宝新能源有限公司100MW风电场项目,50,挂牌,232.4246,,2017,2017年5月,2017/5/2,16140.6,1,16140.6,江苏盐阜银宝新能源有限公司,,,,,,,,,,,,,,2018/1/4,2020/1/3
3417,公共设施用地,盐城市,响水县,220KV清新变（变电所）,灌东盐场境内，临海高等级公路北侧,,划拨,0,,2017,2017年5月,2017/5/2,14005,1,14005,国网江苏省电力公司响水县供电公司,,,,,,,,,,,,,,2017/5/2,2018/5/2
3420,其他商服用地,盐城市,射阳县,射阳县沿海投资有限公司,射阳港经济区向阳公司西侧中心路北侧154号地块,40,挂牌,3020,,2017,2017年5月,2017/5/2,32999.9,3.5,115499.65,射阳县沿海投资有限公司,,,,,,,,,,,,,,2018/7/2,2021/7/2
3421,其他商服用地,盐城市,射阳县,射阳县沿海投资有限公司,射阳港经济区向阳公司西侧中心路北侧152号地块,40,挂牌,3080,,2017,2017年5月,2017/5/2,33666,3.5,117831,射阳县沿海投资有限公司,,,,,,,,,,,,,,2018/7/2,2021/7/2
3422,其他商服用地,盐城市,射阳县,射阳县沿海投资有限公司,射阳港经济区向阳公司西侧中心路北侧153号地块,40,挂牌,3020,,2017,2017年5月,2017/5/2,33000.7,3.5,115502.45,射阳县沿海投资有限公司,,,,,,,,,,,,,,2018/7/2,2021/7/2
3423,其他商服用地,盐城市,射阳县,射阳县沿海投资有限公司,射阳港经济区向阳公司西侧中心路北侧155号地块,40,挂牌,3080,,2017,2017年5月,2017/5/2,33666.7,3.5,117833.45,射阳县沿海投资有限公司,,,,,,,,,,,,,,2018/7/2,2021/7/2
3424,其他商服用地,盐城市,射阳县,射阳县沿海投资有限公司,射阳港经济区向阳公司西侧中心路北侧156号地块,40,挂牌,3050,,2017,2017年5月,2017/5/2,33333.3,3.5,116666.55,射阳县沿海投资有限公司,,,,,,,,,,,,,,2018/7/2,2021/7/2
3425,其他商服用地,盐城市,射阳县,射阳县沿海投资有限公司,射阳港经济区向阳公司西侧中心路北侧157号地块,40,挂牌,3140,,2017,2017年5月,2017/5/2,34333.3,3.5,120166.55,射阳县沿海投资有限公司,,,,,,,,,,,,,,2018/7/2,2021/7/2
3429,公共设施用地,盐城市,射阳县,江苏盐阜银宝新能源有限公司,江苏盐阜银宝射阳风电场升压站,50,挂牌,138.24,,2017,2017年4月,2017/4/27,9600,1,9600,江苏盐阜银宝新能源有限公司,,,,,,,,,,,,,,2017/12/30,2019/12/29
3449,批发零售用地,盐城市,阜宁县,板湖镇戚桥村一组,板湖镇戚桥村一组,40,挂牌,7086,,2017,2017年4月,2017/4/21,134204,4.8,644179.2,阜宁县帅钰铭实业有限公司,,,,,,,,,,,,,,2017/6/16,2019/6/16
3450,批发零售用地,盐城市,阜宁县,板湖镇孙合村一组,板湖镇孙合村一组,40,挂牌,2102,,2017,2017年4月,2017/4/21,34225.33,4.8,164281.584,阜宁县帅钰铭实业有限公司,,,,,,,,,,,,,,2017/6/16,2019/6/16
3451,批发零售用地,盐城市,阜宁县,板湖镇板湖居委员会九组,板湖镇板湖居委会九组,40,挂牌,1306,,2017,2017年4月,2017/4/21,18814.89,4.8,90311.472,阜宁县帅钰铭实业有限公司,,,,,,,,,,,,,,2017/6/16,2019/6/16
3452,其他商服用地,盐城市,滨海县,滨海县城镇建设发展有限公司,滨海县蔬菜批发市场西侧、文广综合服务中心东侧,40,挂牌,3891.888,,2017,2017年4月,2017/4/21,19305,2.5,48262.5,滨海县城镇建设发展有限公司,,,,,,,,,,,,,,2017/6/21,2019/6/21
3453,其他商服用地,盐城市,射阳县,盐城碧桂园房地产开发有限公司,百盛花园南侧3号地块,70,挂牌,17700,,2017,2017年4月,2017/4/21,45854,2.2,100878.8,盐城碧桂园房地产开发有限公司,,,,,,,,,,,,,,2018/3/21,2021/3/21
3454,其他商服用地,盐城市,射阳县,盐城国投欧亚实业有限公司,幸福大道南侧海润路东侧地块,70,挂牌,25700,,2017,2017年4月,2017/4/21,81670,2,163340,盐城国投欧亚实业有限公司,,,,,,,,,,,,,,2018/2/21,2021/2/21
3455,其他商服用地,盐城市,射阳县,盐城国投欧亚实业有限公司,台阳软件园南侧,70,挂牌,26600,,2017,2017年4月,2017/4/21,83739.6,2,167479.2,盐城国投欧亚实业有限公司,,,,,,,,,,,,,,2018/2/21,2021/2/21
3456,科教用地,盐城市,射阳县,射阳县黄沙港镇实验幼儿园整体搬迁,射阳县黄沙港镇育才路西侧,,划拨,24.2745,,2017,2017年4月,2017/4/21,5333,1,5333,射阳县黄沙港镇实验幼儿园,,,,,,,,,,,,,,2017/6/5,2019/6/4
3457,殡葬用地,盐城市,东台市,东台市殡仪馆,五烈镇廉贻社区,,划拨,0,,2017,2017年4月,2017/4/21,2341,1,2341,东台市民政局,,,,,,,,,,,,,,2017/10/21,2018/4/20
3458,医卫慈善用地,盐城市,盐都区,盐城市城镇化建设投资集团有限公司,盐城市盐都区崇礼路西、九总沟北侧,40,挂牌,1650.165,,2017,2017年4月,2017/4/20,20002,1.8,36003.6,盐城市城镇化建设投资集团有限公司,,,,,,,,,,,,,,2018/8/17,2020/8/17
3460,医卫慈善用地,盐城市,射阳县,新建妇幼保健院等项目,县城海都路西侧、三中沟南侧,,划拨,0,,2017,2017年4月,2017/4/20,33303,1.8,59945.4,射阳县国有资产投资有限责任公司,,,,,,,,,,,,,,2017/5/18,2019/5/19
3462,公共设施用地,盐城市,建湖县,国网江苏省电力公司盐城供电公司新建吉利220千伏输变电工程项目,颜单镇三虹村三组、古虹村二,,划拨,0,,2017,2017年4月,2017/4/17,10939,0.5,5469.5,国网江苏省电力公司建湖县供电公司,,,,,,,,,,,,,,2017/6/6,2019/6/5
3465,科教用地,盐城市,城南新区,亨威地块小学一期,盐城市城南新区新都街道新墩居委会（开放大道西、聚亨路南侧）,,划拨,0,,2017,2017年4月,2017/4/17,42377.1,0.54,22883.634,盐城市城南新区社会事务管理局,,,,,,,,,,,,,,2017/10/9,2020/10/9
3471,公共设施用地,盐城市,阜宁县,110kv黄埔变电所,阜城街道办事处崔湾一组,,划拨,0,,2017,2017年4月,2017/4/13,5720,1,5720,国网江苏省电力公司盐城供电公司,,,,,,,,,,,,,,2017/5/13,2018/5/13
3475,批发零售用地,盐城市,阜宁县,新沟镇西沙湖景区,新沟镇西沙湖景区,40,挂牌,2468,,2017,2017年4月,2017/4/12,53309.8,0.6,31985.88,中弘恒达投资有限公司,,,,,,,,,,,,,,2017/6/12,2019/6/12
3476,科教用地,盐城市,城南新区,串场河小学,盐城市城南新区新都街道办事处新丰社区居委会,,划拨,0,,2017,2017年4月,2017/4/12,38425,0.87,33429.75,盐城市城南新区社会事务管理局,,,,,,,,,,,,,,2017/7/12,2020/7/13
3477,机关团体用地,盐城市,滨海县,滨海县公安局新建滨海港交警中队业务楼用房工程项目,G228国道西侧（与327省道交叉口向南约300米）,,划拨,0,,2017,2017年4月,2017/4/11,6666.4,0.6,3999.84,滨海县公安局,,,,,,,,,,,,,,2017/12/22,2020/1/24
3482,宗教用地,盐城市,阜宁县,喻口西来佛寺,金沙湖街道喻口居委会,,划拨,0,,2017,2017年4月,2017/4/5,42563.13,0.8,34050.504,江苏省阜宁县佛教协会,,,,,,,,,,,,,,2017/5/5,2018/5/5
3484,公共设施用地,盐城市,盐都区,建设110KV升压站工程项目,盐城市盐都区北龙港街道办事处南龙居委会,,划拨,0,,2017,2017年4月,2017/4/5,5947,0.2,1189.4,盐城市盐都区人民政府盐龙街道办事处,,,,,,,,,,,,,,2017/8/5,2019/8/4
3485,公共设施用地,盐城市,大丰市,垃圾中转站建设项目,大丰区三龙镇龙定路东侧、污水处理厂北侧,,划拨,0,,2017,2017年4月,2017/4/5,2994,1,2994,盐城市大丰区三龙镇人民政府,,,,,,,,,,,,,,2017/9/10,2018/9/10
3488,医卫慈善用地,盐城市,亭湖区,新建住院楼项目,盐城市亭湖区南洋镇三尖居民委员会七组,,划拨,0,,2017,2017年3月,2017/3/30,3689,0.65,2397.85,盐城市亭湖区青墩卫生院,,,,,,,,,,,,,,2017/6/30,2018/6/30
3490,医卫慈善用地,盐城市,东台市,头灶敬老院,头灶镇东蹲路北侧，保丰村部东侧,,划拨,0,,2017,2017年3月,2017/3/29,15805,0.38,6005.9,东台市头灶镇敬老院,,,,,,,,,,,,,,2017/10/20,2019/4/20
3491,医卫慈善用地,盐城市,东台市,曹丿敬老院,头灶镇张港居委会七组,,划拨,0,,2017,2017年3月,2017/3/29,7183,0.36,2585.88,东台市头灶镇曹丿敬老院,,,,,,,,,,,,,,2017/10/20,2018/10/20
3492,医卫慈善用地,盐城市,东台市,市中医院城东新区医院,城东新区和平路南、红星河东,,划拨,0,,2017,2017年3月,2017/3/29,21789,1.3,28325.7,东台市中医院,,,,,,,,,,,,,,2017/11/29,2018/11/29
3493,科教用地,盐城市,东台市,城东新区九年一贯制学校（二期）,城东新区九年一贯制学校一期东、雅居路北,,划拨,0,,2017,2017年3月,2017/3/29,53358,1,53358,东台市城东新区管理委员会,,,,,,,,,,,,,,2017/11/29,2019/11/29
3494,科教用地,盐城市,东台市,城东新区幼儿园,城东新区雅居路北、钱家沟路西,,划拨,0,,2017,2017年3月,2017/3/29,10167,0.9,9150.3,东台市城东新区管理委员会,,,,,,,,,,,,,,2017/11/29,2019/11/29
3496,公共设施用地,盐城市,响水县,职工文化活动中心,黄海农场创业路北侧、创业北路东侧,,划拨,0,,2017,2017年3月,2017/3/28,4524,1,4524,江苏省黄海农场,,,,,,,,,,,,,,2017/3/28,2018/3/28
3497,科教用地,盐城市,东台市,东台市实验小学惠阳路分校,市区惠阳路南侧、经五路东侧,,划拨,0,,2017,2017年3月,2017/3/28,32563,1,32563,东台市实验小学,,,,,,,,,,,,,,2017/11/28,2019/11/28
3498,科教用地,盐城市,东台市,东台市幼儿园开发区分园,市经济开发区纬一路南侧,,划拨,0,,2017,2017年3月,2017/3/28,9548,0.8,7638.4,东台市幼儿园,,,,,,,,,,,,,,2017/11/29,2019/5/29
3499,公共设施用地,盐城市,射阳县,新建射阳县委党校二期工程,幸福大道南侧，滨湖大道东侧,,划拨,,,2017,2017年3月,2017/3/27,15992,1,15992,中国共产党射阳县委员会党校,,,,,,,,,,,,,,2018/8/27,2020/8/26
3502,科教用地,盐城市,东台市,东台市三仓镇小学综合楼,三仓镇镇西居委会六组、新元居委会一组,,划拨,0,,2017,2017年3月,2017/3/24,7670,0.65,4985.5,东台市三仓镇小学,,,,,,,,,,,,,,2017/11/15,2018/11/15
3503,公共设施用地,盐城市,建湖县,国网江苏省电力公司盐城供电公司新建冠华110KV输变电工程项目,庆丰镇廖庄村一组、北秦村二组,,划拨,0,,2017,2017年3月,2017/3/24,3792,0.7,2654.4,国网江苏省电力公司盐城供电公司,,,,,,,,,,,,,,2017/8/15,2019/8/14
3505,科教用地,盐城市,东台市,东台市安丰镇中学风雨操场及东门大道,东台市安丰镇安东村一组,,划拨,0,,2017,2017年3月,2017/3/24,182,0.01,1.82,东台市安丰镇中学,,,,,,,,,,,,,,2017/11/24,2019/11/24
3508,公共设施用地,盐城市,东台市,海滨110千伏变电站工程,东台河南侧、沿海高等级公路西侧,,划拨,27.7548,,2017,2017年3月,2017/3/23,4140,0.23,952.2,江苏省电力公司东台供电公司,,,,,,,,,,,,,,2017/9/20,2018/9/20
3514,公共设施用地,盐城市,滨海县,滨海县区域供水沿海片水源项目,滨海县八滩镇,,划拨,0,,2017,2017年3月,2017/3/17,5686,1,5686,滨海县水务有限公司,,,,,,,,,,,,,,2018/3/9,2020/4/10
3516,公共设施用地,盐城市,滨海县,振东供电所,滨海港镇（振东）,,划拨,0,,2017,2017年3月,2017/3/17,5050,1,5050,江苏省电力公司滨海县供电公司,,,,,,,,,,,,,,2018/3/22,2020/5/15
3517,公共设施用地,盐城市,滨海县,大淤尖供电所,滨海县滨海港区,,划拨,0,,2017,2017年3月,2017/3/17,2614,1,2614,江苏省电力公司滨海县供电公司,,,,,,,,,,,,,,2018/5/18,2020/6/19
3520,公共设施用地,盐城市,滨海县,滨海县水务发展有限公司（陈涛增压站）,滨海县陈涛镇境内,,划拨,0,,2017,2017年3月,2017/3/17,3000,1,3000,滨海县水务发展有限公司,,,,,,,,,,,,,,2017/5/17,2018/5/17
3521,公共设施用地,盐城市,滨海县,滨海县城市管理局（垃圾压缩站）,滨海县东坎镇境内,,划拨,0,,2017,2017年3月,2017/3/17,3000,1,3000,滨海县城市管理局,,,,,,,,,,,,,,2017/5/17,2018/5/17
3522,科教用地,盐城市,滨海县,城南初中,滨海县城南区,,划拨,0,,2017,2017年3月,2017/3/16,18308,0.9,16477.2,滨海县教育局,,,,,,,,,,,,,,2018/3/16,2020/4/24
3523,公共设施用地,盐城市,滨海县,高荣（滨响）输变电工程项目,滨海县滨淮镇,,划拨,0,,2017,2017年3月,2017/3/16,40940,1,40940,江苏省电力公司滨海县供电公司,,,,,,,,,,,,,,2018/6/8,2020/7/17
3524,科教用地,盐城市,滨海县,南山产业园地块1（滨海县大学生创业基地）,江苏滨海经济开发区工业园,,划拨,0,,2017,2017年3月,2017/3/16,14649,0.5,7324.5,江苏滨海经济开发区工业园,,,,,,,,,,,,,,2018/3/9,2020/4/17
3526,公共设施用地,盐城市,滨海县,滨海县水务发展有限公司（大套增压站）,滨海县大套境内,,划拨,0,,2017,2017年3月,2017/3/16,3025,1,3025,滨海县水务发展有限公司,,,,,,,,,,,,,,2017/5/16,2018/5/16
3527,公共设施用地,盐城市,滨海县,滨海县水务发展有限公司（界牌增压站）,滨海县界牌镇境内,,划拨,0,,2017,2017年3月,2017/3/16,4167.4,1,4167.4,滨海县水务发展有限公司,,,,,,,,,,,,,,2017/5/16,2018/5/16
3528,公共设施用地,盐城市,滨海县,滨海县水务发展有限公司(滨海港镇增压站）,滨海县滨海港境内,,划拨,0,,2017,2017年3月,2017/3/16,1874.5,1,1874.5,滨海县水务发展有限公司,,,,,,,,,,,,,,2017/5/16,2018/5/16
3529,公共设施用地,盐城市,滨海县,滨海县水务发展有限公司（通榆增压站）,滨海县通榆镇境内,,划拨,0,,2017,2017年3月,2017/3/16,3000,1,3000,滨海县水务发展有限公司,,,,,,,,,,,,,,2017/5/16,2018/5/16
3530,医卫慈善用地,盐城市,滨海县,妇幼保健院,县城327北侧,,划拨,0,,2017,2017年3月,2017/3/16,30868,0.6,18520.8,滨海县卫生和计划生育委员会,,,,,,,,,,,,,,2018/3/9,2020/4/17
3531,公共设施用地,盐城市,滨海县,滨淮镇污水处理厂,滨淮镇境内,,划拨,0,,2017,2017年3月,2017/3/15,7515,0.6,4509,滨海县滨淮镇人民政府,,,,,,,,,,,,,,2018/3/22,2020/4/10
3533,住宿餐饮用地,盐城市,大丰市,盐城市大丰区华丰旅游实业发展有限公司,大中镇建设村四组,40,挂牌,2855,,2017,2017年3月,2017/3/15,31678,1,31678,盐城市大丰区华丰旅游实业发展有限公司,,,,,,,,,,,,,,2017/9/17,2019/9/17
3534,住宿餐饮用地,盐城市,大丰市,大丰新韩酒店有限公司,开发区南翔大道南侧、申丰路西侧,40,挂牌,1765,,2017,2017年3月,2017/3/15,27744,2,55488,大丰新韩酒店有限公司,,,,,,,,,,,,,,2017/9/17,2019/9/17
3535,机关团体用地,盐城市,东台市,为民服务中心,港镇新镇居委会,,划拨,0,,2017,2017年3月,2017/3/15,3940,0.58,2285.2,东台市港镇新镇居民委员会,,,,,,,,,,,,,,2017/11/15,2019/11/15
3536,科教用地,盐城市,滨海县,滨淮中心小学1,滨淮镇境内,,划拨,0,,2017,2017年3月,2017/3/14,3054,0.9,2748.6,滨海县滨淮镇人民政府,,,,,,,,,,,,,,2018/3/16,2020/7/10
3537,公共设施用地,盐城市,滨海县,滨海县区域供水渠南片水源项目,滨海县蔡桥镇,,划拨,0,,2017,2017年3月,2017/3/14,3360,1,3360,滨海县水务有限公司,,,,,,,,,,,,,,2017/9/15,2019/10/10
3538,公共设施用地,盐城市,滨海县,滨海县区域供水县城片水源项目,滨海县县城,,划拨,0,,2017,2017年3月,2017/3/14,6561,1,6561,滨海县水务有限公司,,,,,,,,,,,,,,2018/3/9,2020/4/23
3544,科教用地,盐城市,建湖县,江苏固业软基材料有限公司年产4600万平方米软基材料技改项目,开发区新东村新沟组,50,挂牌,707.6,,2017,2017年3月,2017/3/14,28304,0.7,19812.8,江苏固业软基材料有限公司,,,,,,,,,,,,,,2017/7/3,2019/7/2
3550,住宿餐饮用地,盐城市,大丰市,江苏原乡温泉旅游度假村有限公司,大中镇恒北村三组、四组,40,挂牌,1523,,2017,2017年3月,2017/3/13,26257,1.2,31508.4,江苏原乡温泉旅游度假村有限公司,,,,,,,,,,,,,,2017/9/15,2019/9/15
3553,公共设施用地,盐城市,东台市,东台市南沈灶镇港桥垃圾中转站,东台市南沈灶镇港桥村,,划拨,0,,2017,2017年3月,2017/3/13,1257,1,1257,东台市南沈灶镇人民政府,,,,,,,,,,,,,,2017/4/13,2018/4/13
3556,公共设施用地,盐城市,东台市,东台沿海苏阳达光伏发电有限公司二期20MW渔光互补光伏电站,东台沿海经济区梁南垦区,,划拨,0,,2017,2017年3月,2017/3/13,1980,0.26,514.8,东台沿海苏阳达光伏发电有限公司,,,,,,,,,,,,,,2017/11/13,2019/11/13
3557,公共设施用地,盐城市,东台市,东台沿海苏阳达光伏发电有限公司二期20MW渔光互补光伏电站,东台沿海经济区梁南垦区,,划拨,0,,2017,2017年3月,2017/3/13,4851,0.07,339.57,东台沿海苏阳达光伏发电有限公司,,,,,,,,,,,,,,2017/11/13,2019/11/13
3558,公共设施用地,盐城市,滨海县,图书馆2,滨海县城城东,,划拨,0,,2017,2017年3月,2017/3/10,19967,0.9,17970.3,滨海县文化广电新闻出版局,,,,,,,,,,,,,,2018/3/7,2020/4/10
3562,公共设施用地,盐城市,建湖县,建湖县水利局新建县圩区综合治理九龙口储运中心项目,九龙口镇梁泽村一组,,划拨,0,,2017,2017年3月,2017/3/10,65919,1,65919,建湖县水利局,,,,,,,,,,,,,,2017/9/5,2019/9/4
3563,公共设施用地,盐城市,建湖县,建湖县水利局实施西南片区集中供水工程项目,九龙口镇梁泽村一、五组，竹元村一组,,划拨,0,,2017,2017年3月,2017/3/10,58216,0.3,17464.8,建湖县水利局,,,,,,,,,,,,,,2017/8/30,2019/8/29
3566,其他商服用地,盐城市,盐都区,盐城高新区投资集团有限公司,高新区秦川路东、盐渎路北,40,挂牌,25951.0207,,2017,2017年3月,2017/3/9,136369,1.5,204553.5,盐城高新区投资集团有限公司,,,,,,,,,,,,,,2018/6/9,2021/6/8
3569,科教用地,盐城市,滨海县,城西小学,滨海县城城西,,划拨,0,,2017,2017年3月,2017/3/8,3420,0.6,2052,滨海县教育局,,,,,,,,,,,,,,2018/3/9,2020/4/16
3572,公共设施用地,盐城市,射阳县,新建联检综合楼,射阳港经济区海堤公路东侧S329省道北侧,,划拨,108.6904,,2017,2017年3月,2017/3/7,11235,1.5,16852.5,江苏射阳港港口股份有限公司,,,,,,,,,,,,,,2017/6/1,2019/5/31
3581,公共设施用地,盐城市,亭湖区,新建公交回车场项目,盐城市亭湖区新洋街道办事处袁庄村民委员会八组,,划拨,0,,2017,2017年3月,2017/3/7,10444,1,10444,盐城市新洋经济区管理委员会,,,,,,,,,,,,,,2017/7/10,2020/7/10
3582,公共设施用地,盐城市,亭湖区,盐城市区区域供水工程永丰增压泵站）项目,盐城市亭湖区新兴镇三里村六组,,划拨,0,,2017,2017年3月,2017/3/7,2696,1,2696,盐城市城乡建设局,,,,,,,,,,,,,,2017/7/10,2019/7/10
3583,公共设施用地,盐城市,亭湖区,盐城市区区域供水工程黄尖增压泵站）项目,盐城市亭湖区黄尖镇新同居民委员会三组,,划拨,0,,2017,2017年3月,2017/3/7,3429,1,3429,盐城市城乡建设局,,,,,,,,,,,,,,2017/7/10,2019/7/10
3584,科教用地,盐城市,经济技术开发区,沿海东方之洲项目,盐城经济技术开发区新城街道北舍村、蔡尖社区居委会,50,挂牌,446.8212,,2017,2017年3月,2017/3/6,14994,1.5,22491,江苏沿海东方置业股份有限公司,,,,,,,,,,,,,,2017/9/6,2019/9/6
3585,科教用地,盐城市,经济技术开发区,沿海东方之洲项目,盐城经济技术开发区新城街道北舍村、蔡尖社区居委会,50,挂牌,707.454,,2017,2017年3月,2017/3/6,23820,1.5,35730,江苏沿海东方置业股份有限公司,,,,,,,,,,,,,,2017/9/6,2019/9/6
3587,公共设施用地,盐城市,盐都区,新建秦南镇敬老院项目,盐城市盐都区秦南镇秦北村一组,,划拨,0,,2017,2017年3月,2017/3/6,13333,0.54,7199.82,盐城市盐都区秦南镇人民政府,,,,,,,,,,,,,,2017/7/6,2019/7/5
3596,其他商服用地,盐城市,射阳县,射阳县国有资产投资有限责任公司,射阳港经济区射阳河入海口南海堤堆东侧地块六,70,挂牌,3220,,2017,2017年3月,2017/3/3,34661.8,3.5,121316.3,射阳县国有资产投资有限责任公司,,,,,,,,,,,,,,2018/1/3,2021/1/3
3597,其他商服用地,盐城市,射阳县,射阳县国有资产投资有限责任公司,射阳港经济区射阳河入海口南海堤堆东侧地块七,70,挂牌,3115,,2017,2017年3月,2017/3/3,33523.5,3.5,117332.25,射阳县国有资产投资有限责任公司,,,,,,,,,,,,,,2018/1/3,2021/1/3
