2878,科教用地,泰州市,兴化市,王华桂,兴化市戴窑镇东首、戴舍路东侧,50,挂牌出让,,887,,2017,######,######,19122.6,0.7,13385.82,王华桂,,,,,,,,,,,,,,######,######
2879,住宿餐饮用地,泰州市,兴化市,李德平,兴化市戴窑镇窑东村、人民路南侧,40,挂牌出让,,426,,2017,######,######,3550.1,2.1,7455.21,李德平,,,,,,,,,,,,,,######,######
2889,其他商服用地,泰州市,靖江市,商业,牧城公园东侧,40,挂牌出让,,3860,,2017,######,######,28628,2.2,62981.6,靖江新时代房地产开发有限公司,,,,,,,,,,,,,,######,######
2890,批发零售用地,泰州市,兴化市,戚新生,兴化市安丰镇新北郊村、北环路北侧,40,挂牌出让,,1290,,2017,######,######,11636.9,2.2,25601.18,戚新生,,,,,,,,,,,,,,######,######
2892,医卫慈善用地,泰州市,兴化市,戴窑镇中心敬老院,兴化市戴窑镇东三村,40,划拨,,0,,2017,######,######,5270.7,0.82,4321.974,兴化市戴窑镇人民政府,,,,,,,,,,,,,,######,######
2893,机关团体用地,泰州市,兴化市,兴化市公安局英武派出所新建工程,兴化市张家路北、西过境公路西,40,划拨,,0,,2017,######,######,6542.5,0.44,2878.7,兴化市公安局,,,,,,,,,,,,,,######,######
2894,科教用地,泰州市,靖江市,(富江幼儿园)靖江市新桥城乡建设有限公司,新桥镇文东村,40,划拨,,0,,2017,######,######,11210,0.46,5156.6,靖江市新桥城乡建设有限公司,,,,,,,,,,,,,,######,######
2902,批发零售用地,泰州市,泰兴市,江苏和福房地产开发有限公司,根思路北侧、拱极路西侧地块,70,挂牌出让,,29600,,2017,######,######,68120,2,136240,江苏和福房地产开发有限公司,,,,,,,,,,,,,,######,######
2903,批发零售用地,泰州市,兴化市,江苏春龙亚麻纺织有限公司,兴泰公路东侧（临城镇古庄村）,40,拍卖出让,,2002,,2017,######,######,652,0.7,456.4,江苏春龙亚麻纺织有限公司,,,,,,,,,,,,,,######,######
2907,商务金融用地,泰州市,泰州市本级,医药高新区会展2号支路北侧、3号支路西侧,医药高新区会展2号支路北侧、3号支路西侧,40,挂牌出让,,2500,,2017,######,######,9248,4.66,43095.68,泰州鑫泰集团有限公司,,,,,,,,,,,,,,######,######
2935,商务金融用地,泰州市,海陵区,海陵区莲花1号区37幢南大门西第5间,海陵区莲花1号区37幢南大门西第5间,40,协议出让,,34.2363,,2017,######,######,97.8,1,97.8,泰州市沁莲物业管理有限公司,,,,,,,,,,,,,,######,######
2936,医卫慈善用地,泰州市,泰兴市,泰兴市兴宁养老院,泰兴市广陵镇兴宁社区14组,40,划拨,,0,,2017,######,######,929.51,3,2788.53,泰兴市兴宁养老院,,,,,,,,,,,,,,######,######
2951,批发零售用地,泰州市,泰兴市,江苏沣源二手车交易市场有限公司,东阳路西侧、银杏路北侧,40,挂牌出让,,4730,,2016,2016年12,######,59377,0.6,35626.2,江苏沣源二手车交易市场有限公司,,,,,,,,,,,,,,######,######
2952,批发零售用地,泰州市,泰兴市,新城控股集团房地产开发有限公司,鼓楼北路东侧、根思路南侧,40,挂牌出让,,46650,,2016,2016年12,######,134511,2.4,322826.4,新城控股集团房地产开发有限公司,,,,,,,,,,,,,,######,######
2983,科教用地,泰州市,泰兴市,泰兴市第二高级中学,龙河路北侧、园林路西侧,40,划拨,,0,,2016,2016年12,######,11286,1,11286,泰兴市第二高级中学,,,,,,,,,,,,,,######,######
2990,商务金融用地,泰州市,泰州市本级,医药高新区泰州大道西侧、学院路南侧,医药高新区泰州大道西侧、学院路南侧,40,挂牌出让,,19000,,2016,2016年12,######,97720,1.12,109446.4,泰州华康工程管理有限公司,,,,,,,,,,,,,,######,######
2992,街巷用地,泰州市,姜堰市,天目路工程,罗塘街道城北村,40,划拨,,0,,2016,2016年12,######,20443,1,20443,泰州市姜堰城市建设投资发展有限公司,,,,,,,,,,,,,,######,######
3049,商务金融用地,泰州市,泰兴市,江苏泰兴农村商业银行股份有限公司,珊瑚镇金珊瑚路南侧红珊瑚路西侧,40,挂牌出让,,192,,2016,2016年12,######,1573,1.6,2516.8,江苏泰兴农村商业银行股份有限公司,,,,,,,,,,,,,,######,######
3050,批发零售用地,泰州市,泰兴市,王全庆,元竹镇姜八公路东侧,40,挂牌出让,,144,,2016,2016年12,######,1635,2,3270,王全庆,,,,,,,,,,,,,,######,######
3088,医卫慈善用地,泰州市,泰兴市,泰兴市中泰养老产业投资有限公司,文昌路南侧、润泰路西侧地块,50,挂牌出让,,4150,,2016,2016年12,######,15955,1.21,19305.55,泰兴市中泰养老产业投资有限公司,,,,,,,,,,,,,,######,######
3089,医卫慈善用地,泰州市,泰兴市,泰兴市中泰养老产业投资有限公司,文昌路南侧、润泰路西侧地块,50,挂牌出让,,15950,,2016,2016年12,######,62792,1.21,75978.32,泰兴市中泰养老产业投资有限公司,,,,,,,,,,,,,,######,######
3095,医卫慈善用地,泰州市,泰兴市,泰兴市新街护理院,农产品加工园区果蔬路东侧纬二路南侧,50,挂牌出让,,263,,2016,2016年12,######,5594,1,5594,泰兴市新街护理院,,,,,,,,,,,,,,######,######
3107,机关团体用地,泰州市,泰兴市,泰兴市黄桥新农村建设有限公司,黄桥镇东进西路南侧、龙溪路东侧,40,划拨,,0,,2016,2016年12,######,9190,1.2,11028,泰兴市黄桥新农村建设有限公司,,,,,,,,,,,,,,######,######
3108,科教用地,泰州市,姜堰市,开发区幼儿园,开发区陆庄村、西陆村,40,划拨,,0,,2016,2016年12,######,8397,1.5,12595.5,江苏省姜堰经济开发区管理委员会,,,,,,,,,,,,,,######,######
3109,医卫慈善用地,泰州市,姜堰市,开发区医院,开发区陈庄村、新河村,40,划拨,,0,,2016,2016年12,######,33351,2.2,73372.2,泰州市第二人民医院,,,,,,,,,,,,,,######,######
3111,商务金融用地,泰州市,海陵区,海陵区迎春东路北侧、231省道东侧约50米,海陵区迎春东路北侧、231省道东侧约50米,40,挂牌出让,,7600,,2016,2016年12,######,26740,2.55,68187,中城建俊和建设发展（泰州）有限公司,,,,,,,,,,,,,,######,######
3112,批发零售用地,泰州市,泰兴市,泰兴市黄桥新农村建设有限公司,泰兴市黄桥镇横过线南侧,40,挂牌出让,,1290,,2016,2016年12,######,13546,0.6,8127.6,泰兴市黄桥新农村建设有限公司,,,,,,,,,,,,,,######,######
3114,科教用地,泰州市,泰兴市,泰兴市溪桥初级中学,黄桥镇金溪路西侧、银杏路南侧,40,划拨,,0,,2016,2016年12,######,59670,1.2,71604,泰兴市溪桥初级中学,,,,,,,,,,,,,,######,######
3118,商务金融用地,泰州市,泰兴市,江苏黄桥建设工程有限公司,黄桥镇清华园路西侧东华村路北侧,40,挂牌出让,,927,,2016,2016年12,######,8057,2.8,22559.6,江苏黄桥建设工程有限公司,,,,,,,,,,,,,,######,######
3119,批发零售用地,泰州市,泰兴市,徐根富,黄桥镇金溪路西侧银杏路南侧,40,挂牌出让,,720,,2016,2016年12,######,3946,1.5,5919,徐根富,,,,,,,,,,,,,,######,######
3120,机关团体用地,泰州市,兴化市,大垛镇社会综合服务中心,兴化市大垛镇中兴路北侧,40,划拨,,0,,2016,2016年12,######,784.7,1.96,1538.012,兴化市大垛镇人民政府,,,,,,,,,,,,,,######,######
3121,科教用地,泰州市,兴化市,市直机关幼儿园城东分园改扩建工程,兴化市板桥路东侧、玉带路南侧,40,划拨,,0,,2016,2016年12,######,3238,0.78,2525.64,兴化市市直机关幼儿园,,,,,,,,,,,,,,######,######
3122,科教用地,泰州市,兴化市,陈堡镇中心幼儿园新建工程,兴化市陈堡镇交通北路东侧,40,划拨,,0,,2016,2016年12,######,5032,1.09,5484.88,兴化市陈堡镇中心幼儿园,,,,,,,,,,,,,,######,######
3130,批发零售用地,泰州市,泰兴市,泰兴市金禾天然气有限公司,泰兴市虹桥工业园区临港产业大道东侧六圩港南侧,40,挂牌出让,,350,,2016,2016年12,######,2860,0.2,572,泰兴市金禾天然气有限公司,,,,,,,,,,,,,,######,######
3131,批发零售用地,泰州市,泰州市本级,医药高新区口泰路东侧、鸭子河南侧,医药高新区口泰路东侧、鸭子河南侧,40,挂牌出让,,8300,,2016,2016年12,######,54652,0.52,28419.04,江苏华联东方置业有限公司,,,,,,,,,,,,,,######,######
3133,其他商服用地,泰州市,靖江市,商业（现代服务业公司）,阳光大道南侧，晨阳路西侧，富阳路北侧，同安路东侧,40,挂牌出让,,36293,,2016,2016年11,######,120971,2.2,266136.2,靖江市现代服务业发展有限公司,,,,,,,,,,,,,,######,######
3134,其他商服用地,泰州市,靖江市,商业（滨江新城有限公司）,阳光大道南侧，新洲路北侧，同兴路东侧,40,挂牌出让,,23525,,2016,2016年11,######,104555,1.3,135921.5,靖江市滨江新城投资开发有限公司,,,,,,,,,,,,,,######,######
3135,其他商服用地,泰州市,靖江市,商业（汽贸城）,联泰路东侧，车管路北侧，通达河南侧,40,挂牌出让,,3165,,2016,2016年11,######,31206,1.2,37447.2,靖江市国际汽贸城开发有限公司,,,,,,,,,,,,,,######,######
3145,医卫慈善用地,泰州市,泰兴市,泰兴市黄桥南沙社区老年关爱之家,泰兴市黄桥镇南沙村,50,协议出让,,45.507,,2016,2016年11,######,1379,1.2,1654.8,泰兴市黄桥南沙社区老年关爱之家,,,,,,,,,,,,,,######,######
3156,批发零售用地,泰州市,泰兴市,泰兴市中泰城市建设投资有限公司,济川路东侧、同德路南侧地块,40,挂牌出让,,58450,,2016,2016年11,######,74340,3.5,260190,泰兴市中泰城市建设投资有限公司,,,,,,,,,,,,,,######,######
3161,批发零售用地,泰州市,泰兴市,江苏金宇防腐科技有限公司,泰兴市曲霞镇曲霞大街南侧,40,挂牌出让,,146,,2016,2016年11,######,2275,1.3,2957.5,江苏金宇防腐科技有限公司,,,,,,,,,,,,,,######,######
3163,科教用地,泰州市,泰兴市,泰兴市济川小学,泰兴市润泰路西侧、曾涛路南侧,40,划拨,,0,,2016,2016年11,######,530,1.2,636,泰兴市济川小学,,,,,,,,,,,,,,######,######
3170,批发零售用地,泰州市,泰兴市,河南远大可持续建筑科技有限公司,镇海路东侧、鼓楼东路南侧,40,挂牌出让,,8581,,2016,2016年11,######,53300,2.75,146575,河南远大可持续建筑科技有限公司,,,,,,,,,,,,,,######,######
3190,医卫慈善用地,泰州市,泰兴市,江苏省泰兴虹桥工业园区管理委员会,虹桥镇彩虹路东侧、健康路北侧,40,划拨,,0,,2016,2016年11,######,7108,1.2,8529.6,江苏省泰兴虹桥工业园区管理委员会,,,,,,,,,,,,,,######,######
3191,科教用地,泰州市,泰州市本级,泰州市第一外国语学校项目工程,泰州医药高新技术产业开发区野徐镇仲联村境内,40,划拨,,0,,2016,2016年11,######,99178,0.79,78350.62,泰州华信药业投资有限公司,,,,,,,,,,,,,,######,######
3227,批发零售用地,泰州市,海陵区,莲花小区B1（8-9）,海陵区莲花1号区B1（8-9）,40,协议出让,,52.1948,,2016,2016年10,######,87,2.27,197.49,余喜峰,,,,,,,,,,,,,,######,######
3234,其他商服用地,泰州市,泰兴市,泰兴市广陵食品购销站,广陵镇东街南侧,40,协议出让,,21.336,,2016,2016年10,######,240,1.2,288,泰兴市广陵食品购销站,,,,,,,,,,,,,,######,######
3244,宗教用地,泰州市,泰州市本级,基督教堂新堂项目,泰州医药高新技术产业开发区凤凰街道振兴村境内,40,划拨,,0,,2016,2016年10,######,6667,0.69,4600.23,泰州市城市基础设施建设发展有限公司,,,,,,,,,,,,,,######,######
3245,宗教用地,泰州市,高港区,古寿胜寺,高港区口岸街道张马社区及徐庄村境内,40,划拨,,0,,2016,2016年10,######,73244,0.33,24170.52,泰州市高港区佛教协会,,,,,,,,,,,,,,######,######
3255,批发零售用地,泰州市,高港区,港城花苑,高港区港城公园东侧,40,协议出让,,1573.744,,2016,######,######,2009,2.67,5364.03,泰州市高港房地产开发公司,,,,,,,,,,,,,,######,######
3261,其他商服用地,泰州市,泰兴市,顾兵、严春红,古溪镇横垛居委会振兴路,40,协议出让,,11.62,,2016,######,######,144.48,3,433.44,顾兵、严春红,,,,,,,,,,,,,,######,######
3262,商务金融用地,泰州市,泰兴市,朱启林、钱纪霞,古溪镇横垛居委会振兴路,40,协议出让,,8.46,,2016,######,######,72.36,3,217.08,朱启林、钱纪霞,,,,,,,,,,,,,,######,######
3268,批发零售用地,泰州市,高港区,高港区永安洲镇沿江高等级公路西侧、联江物流园南侧,高港区永安洲镇沿江高等级公路西侧、联江物流园南侧,40,挂牌出让,,640,,2016,######,######,3450,0.7,2415,中国石化销售有限公司江苏泰州石油分公司,,,,,,,,,,,,,,######,######
3269,商务金融用地,泰州市,泰兴市,泰兴市兴黄综合投资开发有限公司,黄桥镇城黄东路北侧1号地块,70,挂牌出让,,735,,2016,######,######,2310,3,6930,泰兴市兴黄综合投资开发有限公司,,,,,,,,,,,,,,######,######
3270,商务金融用地,泰州市,泰兴市,泰兴市兴黄综合投资开发有限公司,黄桥镇城黄东路北侧2号地块,70,挂牌出让,,5025,,2016,######,######,16860,3,50580,泰兴市兴黄综合投资开发有限公司,,,,,,,,,,,,,,######,######
3271,商务金融用地,泰州市,泰兴市,泰兴市兴黄综合投资开发有限公司,黄桥镇城黄路南侧1号地块,70,挂牌出让,,4090,,2016,######,######,13687,3,41061,泰兴市兴黄综合投资开发有限公司,,,,,,,,,,,,,,######,######
3272,商务金融用地,泰州市,泰兴市,泰兴市兴黄综合投资开发有限公司,黄桥镇城黄路南2号,70,挂牌出让,,8180,,2016,######,######,27548,3,82644,泰兴市兴黄综合投资开发有限公司,,,,,,,,,,,,,,######,######
3273,商务金融用地,泰州市,泰兴市,泰兴市兴黄综合投资开发有限公司,黄桥镇通站路南侧,70,挂牌出让,,7810,,2016,######,######,26659,3,79977,泰兴市兴黄综合投资开发有限公司,,,,,,,,,,,,,,######,######
3281,商务金融用地,泰州市,泰兴市,泰兴市兴黄综合投资开发有限公司,黄桥镇北环路南、致富北路西侧,70,挂牌出让,,15745,,2016,######,######,54296,3,162888,泰兴市兴黄综合投资开发有限公司,,,,,,,,,,,,,,######,######
3282,商务金融用地,泰州市,泰兴市,泰兴市兴黄综合投资开发有限公司,黄桥镇通站路北侧地块,70,挂牌出让,,5870,,2016,######,######,20000,3,60000,泰兴市兴黄综合投资开发有限公司,,,,,,,,,,,,,,######,######
3283,机关团体用地,泰州市,泰兴市,泰兴市公安局,宣堡镇宣银路北侧,40,划拨,,0,,2016,######,######,2043,1.2,2451.6,泰兴市公安局,,,,,,,,,,,,,,######,######
3284,科教用地,泰州市,泰兴市,泰兴市曲霞小学,曲霞镇育才路,40,划拨,,0,,2016,######,######,18672,1.2,22406.4,泰兴市曲霞小学,,,,,,,,,,,,,,######,######
3286,批发零售用地,泰州市,海陵区,西仓路11号1幢13室,西仓路11号1幢13室,40,协议出让,,19.2183,,2016,######,######,8.03,4.19,33.6457,王翔、王锦芳,,,,,,,,,,,,,,######,######
3292,医卫慈善用地,泰州市,兴化市,兴化市第三人民医院迁址改造工程,兴化市昭阳路北侧、丰收路西侧,40,划拨,,0,,2016,######,######,30504,0.47,14336.88,兴化市第三人民医院,,,,,,,,,,,,,,######,######
3299,科教用地,泰州市,高港区,市委党校迁建工程,高港区白马镇金马居委会及前进村境内,40,划拨,,0,,2016,######,######,65545,0.48,31461.6,中共泰州市委党校,,,,,,,,,,,,,,######,######
3300,科教用地,泰州市,高港区,海军小学,高港区白马镇陆家村及白马居委会境内,40,划拨,,0,,2016,######,######,26876,0.7,18813.2,泰州市白马镇人民政府,,,,,,,,,,,,,,######,######
3301,住宿餐饮用地,泰州市,兴化市,兴化市里下河五丰农业观光园有限公司,兴化市李中镇黄邳村、景区连接线北侧,40,挂牌出让,,312,,2016,######,######,6957.7,1.4,9740.78,兴化市里下河五丰农业观光园有限公司,,,,,,,,,,,,,,######,######
3302,住宿餐饮用地,泰州市,兴化市,江苏李中水上森林旅游投资有限公司,兴化市李中镇水上森林公园南侧,40,挂牌出让,,275,,2016,######,######,6380.4,1.2,7656.48,江苏李中水上森林旅游投资有限公司,,,,,,,,,,,,,,######,######
3305,科教用地,泰州市,泰兴市,泰兴市古溪镇人民政府,古溪镇横垛社区育才路东侧,40,划拨,,0,,2016,######,######,8855,1.2,10626,泰兴市古溪镇人民政府,,,,,,,,,,,,,,######,######
3306,住宿餐饮用地,泰州市,兴化市,江苏李中水上森林旅游投资有限公司,兴化市李中镇水上森林公园南侧,40,挂牌出让,,250,,2016,######,######,5220.5,1.46,7621.93,江苏李中水上森林旅游投资有限公司,,,,,,,,,,,,,,######,######
3325,批发零售用地,泰州市,泰兴市,泰兴市鑫宇汽车销售服务有限公司,镇海路东侧、银杏路南侧（汽贸城二期2号地块）,40,挂牌出让,,998,,2016,######,######,9972,1.5,14958,泰兴市鑫宇汽车销售服务有限公司,,,,,,,,,,,,,,######,######
3327,批发零售用地,泰州市,海陵区,海陵区祥泰路东侧、规划泰九路北侧,海陵区祥泰路东侧、规划泰九路北侧,40,挂牌出让,,880,,2016,######,######,6237,0.4,2494.8,泰州市北郊加油站,,,,,,,,,,,,,,######,######
3328,科教用地,泰州市,兴化市,周庄镇边城学校幼儿园迁建工程,兴化市周庄镇边城社区团结路北侧,40,划拨,,0,,2016,######,######,4686,0.57,2671.02,兴化市周庄镇人民政府,,,,,,,,,,,,,,######,######
3331,其他商服用地,泰州市,靖江市,商业（中海油）,东兴镇万盛村,40,拍卖出让,,2650,,2016,######,######,3359,0.4,1343.6,中海油销售泰州有限公司,,,,,,,,,,,,,,######,######
3334,科教用地,泰州市,泰兴市,泰兴市根思乡人民政府,根思乡振兴路南侧,40,划拨,,0,,2016,######,######,6337,1.2,7604.4,泰兴市根思乡人民政府,,,,,,,,,,,,,,######,######
3345,住宿餐饮用地,泰州市,海陵区,海陵区扬州路北侧、杰盛西苑东侧,海陵区扬州路北侧、杰盛西苑东侧,40,挂牌出让,,2650,,2016,######,######,7702,2.35,18099.7,泰州市荟特酒店管理有限公司,,,,,,,,,,,,,,######,######
3353,其他商服用地,泰州市,靖江市,商业（新世纪邮政印刷）,马桥徐周大道东侧,40,挂牌出让,,220,,2016,######,######,2673,1.5,4009.5,靖江市新世纪邮政印刷有限公司,,,,,,,,,,,,,,######,######
3355,其他商服用地,泰州市,靖江市,加油、加气站,公新公路南侧,40,挂牌出让,,1185,,2016,######,######,2636,0.4,1054.4,中国石油天然气股份有限公司江苏销售分公司,,,,,,,,,,,,,,######,######
3361,其他商服用地,泰州市,靖江市,商业（舒源空调）,中洲路与兴业路交界处西北侧,40,拍卖出让,,604,,2016,######,######,3500,1.55,5425,江苏舒源空调制造有限公司,,,,,,,,,,,,,,######,######
3377,商务金融用地,泰州市,靖江市,商务（新程汽配）,康兴路东侧，富阳路南侧,40,挂牌出让,,4928,,2016,######,######,23455,1.3,30491.5,江苏新程汽配制造有限公司,,,,,,,,,,,,,,######,######
3393,其他商服用地,泰州市,靖江市,商服用地（华穗粮食有限公司）,东兴北路东侧,40,拍卖出让,,1450,,2016,######,######,17167,1.5,25750.5,江苏华穗粮食有限公司,,,,,,,,,,,,,,######,######
3394,其他商服用地,泰州市,靖江市,商服用地（华穗粮食有限公司）,新夹公路西侧,40,拍卖出让,,1131,,2016,######,######,14363,1.5,21544.5,江苏华穗粮食有限公司,,,,,,,,,,,,,,######,######
3395,其他商服用地,泰州市,靖江市,商服用地（华穗粮食有限公司）,青龙港东侧,40,拍卖出让,,708,,2016,######,######,8660.5,1.5,12990.75,江苏华穗粮食有限公司,,,,,,,,,,,,,,######,######
3396,其他商服用地,泰州市,靖江市,商服用地（华穗粮食有限公司）,生产港南侧,40,拍卖出让,,496,,2016,######,######,6308,1.5,9462,江苏华穗粮食有限公司,,,,,,,,,,,,,,######,######
3397,其他商服用地,泰州市,靖江市,商服用地（华穗粮食有限公司）,季市中路东侧,40,拍卖出让,,820,,2016,######,######,8950,1.5,13425,江苏华穗粮食有限公司,,,,,,,,,,,,,,######,######
3398,其他商服用地,泰州市,靖江市,商服用地（华穗粮食有限公司）,水洞港东侧,40,拍卖出让,,636,,2016,######,######,9778.5,1.5,14667.75,江苏华穗粮食有限公司,,,,,,,,,,,,,,######,######
3399,其他商服用地,泰州市,靖江市,商服用地（华穗粮食有限公司）,上五圩港西侧,40,拍卖出让,,382,,2016,######,######,6100,2,12200,江苏华穗粮食有限公司,,,,,,,,,,,,,,######,######
3400,其他商服用地,泰州市,靖江市,商服用地（华穗粮食有限公司）,生东路西侧,40,拍卖出让,,671,,2016,######,######,8054,1.5,12081,江苏华穗粮食有限公司,,,,,,,,,,,,,,######,######
3401,其他商服用地,泰州市,靖江市,商服用地（华穗粮食有限公司）,姜八公路东侧,40,拍卖出让,,902,,2016,######,######,11003.6,1.5,16505.4,江苏华穗粮食有限公司,,,,,,,,,,,,,,######,######
3402,其他商服用地,泰州市,靖江市,商服用地（华穗粮食有限公司）,天生港东侧,40,拍卖出让,,805,,2016,######,######,9173.5,1.5,13760.25,江苏华穗粮食有限公司,,,,,,,,,,,,,,######,######
3403,其他商服用地,泰州市,靖江市,商服用地（华穗粮食有限公司）,红南路东侧,40,拍卖出让,,578,,2016,######,######,7873.5,1.5,11810.25,江苏华穗粮食有限公司,,,,,,,,,,,,,,######,######
3404,其他商服用地,泰州市,靖江市,商服用地（华穗粮食有限公司）,江平路北侧,40,拍卖出让,,1230,,2016,######,######,12986,1.5,19479,江苏华穗粮食有限公司,,,,,,,,,,,,,,######,######
3405,医卫慈善用地,泰州市,靖江市,靖江市滨江新区卫生院,靖城镇越江村,40,划拨,,0,,2016,######,######,1687,1.35,2277.45,靖江市滨江新区卫生院,,,,,,,,,,,,,,######,######
3406,其他商服用地,泰州市,靖江市,商业（保税物流）,沿江高等级公路南侧，斜新公路西侧,40,拍卖出让,,86200,,2016,######,######,164233,1.6,262772.8,靖江市保税物流中心有限公司,,,,,,,,,,,,,,######,######
3422,批发零售用地,泰州市,兴化市,江苏泰汇现代物流股份有限公司,兴化戴南镇史堡村、雁伦村和张郭镇千户村,40,挂牌出让,,5284,,2016,######,######,125431.9,0.72,90310.97,江苏泰汇现代物流股份有限公司,,,,,,,,,,,,,,######,######
3423,住宿餐饮用地,泰州市,兴化市,兴化市安丰镇中鼎大酒店,兴化市安丰镇张阳村宁盐公路西侧,40,挂牌出让,,210,,2016,######,######,2104.8,3.65,7682.52,兴化市安丰镇中鼎大酒店,,,,,,,,,,,,,,######,######
3424,其他商服用地,泰州市,姜堰市,江苏幅源伟沃投资有限公司等三家单位,姜堰区人民北路东侧、姜堰大道北侧,40,挂牌出让,,7454,,2016,######,######,20036,3,60108,江苏幅源伟沃投资有限公司等三家单位,,,,,,,,,,,,,,######,######
3431,科教用地,泰州市,泰州市本级,泰州职业技术学院中国医药城校区项目,刁铺街道通太社区及泰州医药高新区寺巷镇南塘、帅于两村境内,40,划拨,,0,,2016,######,######,533913,0.58,309669.5,泰州华诚医学投资集团有限公司,,,,,,,,,,,,,,######,######
3437,批发零售用地,泰州市,海陵区,泰州市光明副食品商场,泰州市迎春路二期1号04、05室,40,协议出让,,93.4684,,2016,######,######,40.58,5.24,212.6392,泰州市天安房屋拆迁有限公司,,,,,,,,,,,,,,######,######
3451,医卫慈善用地,泰州市,姜堰市,港口卫生院门诊病房综合楼,华港镇港口村,40,划拨,,0,,2016,######,######,8954,0.49,4387.46,泰州市姜堰区港口卫生院,,,,,,,,,,,,,,######,######
3468,科教用地,泰州市,靖江市,（市职业教育中心）靖江新港城投资建设有限公司,斜桥镇斜桥村,40,划拨,,0,,2016,######,######,105154,0.89,93587.06,靖江新港城投资建设有限公司,,,,,,,,,,,,,,######,######
3476,科教用地,泰州市,靖江市,（常州大学怀德学院（靖江））靖江新港城投资建设有限公司,靖江市斜桥镇安宁村、丰宁村,40,划拨,,0,,2016,######,######,497760,0.52,258835.2,靖江新港城投资建设有限公司,,,,,,,,,,,,,,######,######
3477,科教用地,泰州市,兴化市,兴化市永丰镇中心幼儿园,兴化市永丰镇徐杨村,40,划拨,,0,,2016,######,######,6666.7,1.12,7466.704,兴化市永丰镇中心幼儿园,,,,,,,,,,,,,,######,######
3495,其他商服用地,泰州市,姜堰市,泰州市嘉信房地产有限公司,姜堰区溱潼镇华光大桥南侧、姜溱河西侧,40,挂牌出让,,795,,2016,######,######,11301,1.2,13561.2,泰州市嘉信房地产有限公司,,,,,,,,,,,,,,######,######
3496,科教用地,泰州市,兴化市,兴化市周庄高级中学,兴化市周庄镇迎宾路北侧,40,划拨,,0,,2016,######,######,3394,0.76,2579.44,兴化市周庄高级中学,,,,,,,,,,,,,,######,######
3497,医卫慈善用地,泰州市,泰兴市,泰兴市滨江卫生院,开发区祥瑞路西侧、疏港路南侧,40,划拨,,0,,2016,######,######,9966,1.2,11959.2,泰兴市滨江卫生院,,,,,,,,,,,,,,######,######
3500,殡葬用地,泰州市,泰兴市,泰兴市黄桥殡仪馆,黄桥镇姜八公路西侧、姜黄河南侧,40,划拨,,0,,2016,######,######,2906,1.2,3487.2,泰兴市黄桥殡仪馆,,,,,,,,,,,,,,######,######
3504,科教用地,泰州市,泰兴市,宣堡镇人民政府,宣堡镇中央路北侧,50,挂牌出让,,315,,2016,######,######,5405,1.2,6486,宣堡镇人民政府,,,,,,,,,,,,,,######,######
3514,医卫慈善用地,泰州市,泰兴市,顾金祥,市区文江路东侧、兴南路南侧,50,挂牌出让,,1952,,2016,######,######,25888,1.6,41420.8,顾金祥,,,,,,,,,,,,,,######,######
