1990,批发零售用地,泰州市,泰兴市,泰州思元置业有限公司,滨江镇瑞祥路西侧、丰产路南侧,40,挂牌出让,,2628,,2018,######,######,16434,2,32868,泰州思元置业有限公司,,,,,,,,,,,,,,######,######
1992,批发零售用地,泰州市,泰兴市,江苏康梦尔大酒店有限公司,农产品园区粮油路东侧、纬二路南侧,40,挂牌出让,,190,,2018,######,######,2069,2,4138,江苏康梦尔大酒店有限公司,,,,,,,,,,,,,,######,######
1997,医卫慈善用地,泰州市,姜堰市,淤溪镇福利院,淤溪镇淤溪村,40,划拨,,0,,2018,######,######,2004,1,2004,泰州市姜堰区淤溪镇人民政府,,,,,,,,,,,,,,######,######
1998,科教用地,泰州市,靖江市,靖江市季市镇季市中心小学,季市镇曙光村,40,划拨,,0,,2018,######,######,23630,0.58,13705.4,靖江市季市镇中心小学,,,,,,,,,,,,,,######,######
2001,街巷用地,泰州市,姜堰市,姜堰经济开发区区间Ⅱ、区间Ⅲ路工程,开发区军铺村,40,划拨,,0,,2018,######,######,18318,1,18318,泰州市姜堰区鑫源建设有限公司,,,,,,,,,,,,,,######,######
2004,街巷用地,泰州市,姜堰市,姜堰经济开发区纬八路东段工程,开发区南石村,40,划拨,,0,,2018,######,######,7792,1,7792,泰州市姜堰区鑫源建设有限公司,,,,,,,,,,,,,,######,######
2006,科教用地,泰州市,海陵区,泰州市大浦中心小学碧桂园分校,碧桂园社区内,40,划拨,,0,,2018,######,######,58066,0.39,22645.74,泰州市大浦中心小学,,,,,,,,,,,,,,######,######
2009,医卫慈善用地,泰州市,海陵区,碧桂园社区卫生服务中心,碧桂园社区内,40,划拨,,0,,2018,######,######,4300,0.57,2451,泰州市第四人民医院,,,,,,,,,,,,,,######,######
2011,街巷用地,泰州市,海陵区,青年南路安置区交通优化工程,泰州市泰山街道南甫社区、城南街道宝带社区及城东街道高桥村境内,40,划拨,,0,,2018,######,######,9174,1,9174,泰州市城市建设投资集团有限公司,,,,,,,,,,,,,,######,######
2013,街巷用地,泰州市,姜堰市,长江西路工程,罗塘街道沿河村,40,划拨,,0,,2017,2017年12,######,6011,1,6011,泰州市姜堰区交通运输局,,,,,,,,,,,,,,######,######
2014,街巷用地,泰州市,姜堰市,天目路东延项目,罗塘街道城中村,40,划拨,,0,,2017,2017年12,######,3623,1,3623,泰州市姜堰区交通运输局,,,,,,,,,,,,,,######,######
2015,街巷用地,泰州市,姜堰市,体育路项目,罗塘街道沿河村,40,划拨,,0,,2017,2017年12,######,3219,1,3219,泰州市姜堰区交通运输局,,,,,,,,,,,,,,######,######
2017,街巷用地,泰州市,姜堰市,曙光园区道路,白米镇新华村,40,划拨,,0,,2017,2017年12,######,1671,1,1671,泰州市姜堰区白米镇人民政府,,,,,,,,,,,,,,######,######
2019,街巷用地,泰州市,姜堰市,药厂路项目,罗塘街道东桥村,40,划拨,,0,,2017,2017年12,######,2328,1,2328,泰州市姜堰区交通运输局,,,,,,,,,,,,,,######,######
2020,街巷用地,泰州市,姜堰市,白米镇园区道路,白米镇新华村、蛙庄村,40,划拨,,0,,2017,2017年12,######,2229,1,2229,泰州市姜堰区白米镇人民政府,,,,,,,,,,,,,,######,######
2021,科教用地,泰州市,姜堰市,蒋垛中心幼儿园项目,蒋垛镇蒋垛村,40,划拨,,0,,2017,2017年12,######,4247,1,4247,泰州市姜堰区教育局,,,,,,,,,,,,,,######,######
2025,街巷用地,泰州市,姜堰市,道路（航道站西侧）,罗塘街道幸福村,40,划拨,,0,,2017,2017年12,######,2114,1,2114,泰州市姜堰区罗塘街道办事处,,,,,,,,,,,,,,######,######
2027,科教用地,泰州市,姜堰市,姜堰区白米中心小学,白米镇白米村,40,划拨,,0,,2017,2017年12,######,619,1,619,泰州市姜堰区教育局,,,,,,,,,,,,,,######,######
2030,科教用地,泰州市,姜堰市,俞垛中学项目,俞垛镇俞耿村,40,划拨,,0,,2017,2017年12,######,4133,1,4133,泰州市姜堰区教育局,,,,,,,,,,,,,,######,######
2038,街巷用地,泰州市,兴化市,城市公交停车场改造项目,兴化市临城科技工业园区,40,划拨,,0,,2017,2017年12,######,27842,1,27842,兴化市大众公共交通有限公司,,,,,,,,,,,,,,######,######
2113,其他商服用地,泰州市,靖江市,居住（华靖资产）,城东大道两侧，江山路北侧,70,挂牌出让,,50000,,2017,2017年12,######,77043,2,154086,江苏华靖资产经营有限公司,,,,,,,,,,,,,,######,######
2150,住宿餐饮用地,泰州市,兴化市,兴化市西子金座置业有限公司,兴化市文峰路东侧、将军庙路南侧,40,挂牌出让,,1718,,2017,2017年12,######,10213.4,2.85,29108.19,兴化市西子金座置业有限公司,,,,,,,,,,,,,,######,######
2154,其他商服用地,泰州市,靖江市,商业、社会停车场用地（城投公司）,江阳路南侧，合兴路东侧,40,挂牌出让,,2000,,2017,2017年12,######,2222,2.5,5555,靖江市城投基础设施发展有限公司,,,,,,,,,,,,,,######,######
2155,其他商服用地,泰州市,靖江市,商业、社会停车场用地（城投公司）,环城西路东侧，瓜果蔬菜批发市场北侧,40,挂牌出让,,2440,,2017,2017年12,######,5412,2.1,11365.2,靖江市城投基础设施发展有限公司,,,,,,,,,,,,,,######,######
2156,其他商服用地,泰州市,靖江市,商业、社会停车场用地（城投公司）,三江路南侧，人民路西侧,40,挂牌出让,,590,,2017,2017年12,######,774,2.9,2244.6,靖江市城投基础设施发展有限公司,,,,,,,,,,,,,,######,######
2157,其他商服用地,泰州市,靖江市,商业、社会停车场用地（城投公司）,人民路西侧，工农路南侧,40,挂牌出让,,4590,,2017,2017年12,######,3818,1.5,5727,靖江市城投基础设施发展有限公司,,,,,,,,,,,,,,######,######
2158,其他商服用地,泰州市,靖江市,商业（江苏海仑国际贸易有限公司）,人民南路西侧，沿江高等级公路南侧,40,挂牌出让,,1910,,2017,2017年12,######,17026,2.5,42565,江苏海仑国际贸易有限公司,,,,,,,,,,,,,,######,######
2159,机关团体用地,泰州市,泰兴市,泰兴市公安局,农产品加工园区果蔬路西侧、南主干道北侧,40,划拨,,0,,2017,2017年12,######,7944,1,7944,泰兴市公安局,,,,,,,,,,,,,,######,######
2175,新闻出版用地,泰州市,泰兴市,泰兴市文化广电新闻出版局分界广电站,分界镇繁荣路东侧,50,协议出让,,40.02,,2017,2017年12,######,1056,1.2,1267.2,泰兴市文化广电新闻出版局分界广电站,,,,,,,,,,,,,,######,######
2192,批发零售用地,泰州市,泰兴市,泰州玉鸿投资发展有限公司,根思乡宁通高速公路西侧、宣泰公路东侧,40,挂牌出让,,4230,,2017,2017年12,######,71989,1.5,107983.5,泰州玉鸿投资发展有限公司,,,,,,,,,,,,,,######,######
2230,科教用地,泰州市,泰兴市,泰州市高港区机关幼儿园,黄桥镇金溪路西侧、银杏路南侧,40,划拨,,0,,2017,2017年11,######,9221,1.2,11065.2,泰州市高港区机关幼儿园,,,,,,,,,,,,,,######,######
2279,医卫慈善用地,泰州市,泰兴市,泰兴市滨江镇人民政府,滨江镇疏港路南侧、瑞祥路西侧,40,划拨,,0,,2017,2017年11,######,7779,1.2,9334.8,泰兴市滨江镇人民政府,,,,,,,,,,,,,,######,######
2306,批发零售用地,泰州市,姜堰市,钱存根,姜堰区白米镇野沐村三、五组,40,协议出让,,0.816,,2017,2017年11,######,35.3,1,35.3,钱存根,,,,,,,,,,,,,,######,######
2307,科教用地,泰州市,高港区,白马中心幼儿园,高港区白马镇金马居委会境内,40,划拨,,0,,2017,2017年11,######,5996,1.03,6175.88,泰州市白马镇人民政府,,,,,,,,,,,,,,######,######
2351,科教用地,泰州市,海陵区,学校二期扩建项目,海陵区城东街道鲍坝村、京泰路街道宫涵村境内,40,划拨,,0,,2017,2017年11,######,51549,0.67,34537.83,泰州机电高等职业技术学校,,,,,,,,,,,,,,######,######
2371,其他商服用地,泰州市,靖江市,商业（徐亚楠）,东兴镇育才路东侧，文昌路北侧,40,挂牌出让,,183,,2017,2017年11,######,2335,1.5,3502.5,徐亚楠,,,,,,,,,,,,,,######,######
2388,其他商服用地,泰州市,靖江市,商业、商务、住宅（靖江万投置业）,渡江路北侧，植善路南侧，晨阳路西侧，通江路东侧,70,挂牌出让,,72068,,2017,2017年11,######,111729,1.8,201112.2,靖江万投置业有限公司,,,,,,,,,,,,,,######,######
2389,其他商服用地,泰州市,靖江市,住宅、商业、商务、娱乐康体（靖江万投置业）,新洲路南侧，植善路北侧，小桥港西侧，通江路东侧,70,挂牌出让,,76450,,2017,2017年11,######,258971,1.8,466147.8,靖江万投置业有限公司,,,,,,,,,,,,,,######,######
2390,其他商服用地,泰州市,泰兴市,江苏聚源清洗有限公司,经济开发区中港村委会东侧、通江路南侧,40,挂牌出让,,355,,2017,2017年11,######,5352,0.5,2676,江苏聚源清洗有限公司,,,,,,,,,,,,,,######,######
2407,批发零售用地,泰州市,兴化市,兴化市凤城河房地产有限公司,兴化市英武南路东侧、创业路北侧,70,挂牌出让,,43500,,2017,2017年10,######,73973.3,2.2,162741.3,兴化市凤城河房地产有限公司,,,,,,,,,,,,,,######,######
2412,批发零售用地,泰州市,兴化市,中国石油天然气股份有限公司江苏泰州销售分公司,兴化市张郭镇赵万村、352省道南侧,40,挂牌出让,,4406,,2017,2017年10,######,3000,0.3,900,中国石油天然气股份有限公司江苏泰州销售分公司,,,,,,,,,,,,,,######,######
2452,科教用地,泰州市,兴化市,紫荆河小学项目,兴化市兴姜河东路东、城南路北、东外环西,40,划拨,,0,,2017,2017年10,######,45233.5,0.66,29854.11,兴化市文化旅游发展有限公司,,,,,,,,,,,,,,######,######
2483,宗教用地,泰州市,姜堰市,姜堰基督教堂项目,罗塘街道东桥村,40,划拨,,0,,2017,2017年10,######,6562,1,6562,泰州市姜堰基督教堂,,,,,,,,,,,,,,######,######
2484,科教用地,泰州市,姜堰市,马庄中心小学综合楼,淤溪镇马庄村,40,划拨,,0,,2017,2017年10,######,552,1,552,泰州市姜堰区马庄中心小学,,,,,,,,,,,,,,######,######
2510,科教用地,泰州市,泰兴市,泰兴市济川街道办事处,济川路东侧、龙河路北侧,40,划拨,,,,2017,######,######,23615,1.2,28338,泰兴市济川街道办事处,,,,,,,,,,,,,,######,######
2522,科教用地,泰州市,高港区,高港区永安洲镇学府路北侧、中心路西侧约100米,高港区永安洲镇学府路北侧、中心路西侧约100米,50,挂牌出让,,250,,2017,######,######,5122,0.8,4097.6,江苏广鑫投资发展有限公司,,,,,,,,,,,,,,######,######
2524,批发零售用地,泰州市,泰兴市,泰兴市思民食品厂,古溪镇乾坤路南侧,70,挂牌出让,,117,,2017,######,######,1380,1.6,2208,泰兴市思民食品厂,,,,,,,,,,,,,,######,######
2525,住宿餐饮用地,泰州市,泰兴市,陈勃,大庆路南侧、鼓楼北路东侧,40,挂牌出让,,91.8,,2017,######,######,70,2,140,陈勃,,,,,,,,,,,,,,######,######
2526,批发零售用地,泰州市,泰兴市,泰兴市锦城置业有限公司,农产品园区南主干道北侧、粮油路西侧,40,挂牌出让,,610,,2017,######,######,9999,1.5,14998.5,泰兴市锦城置业有限公司,,,,,,,,,,,,,,######,######
2527,医卫慈善用地,泰州市,泰兴市,泰兴市启乐教育科技有限公司,农产品园区纬二路南侧,50,挂牌出让,,335,,2017,######,######,6667,1.1,7333.7,泰兴市启乐教育科技有限公司,,,,,,,,,,,,,,######,######
2529,批发零售用地,泰州市,泰兴市,泰兴市居然之家商业管理有限公司,江平路西侧、阳江路北侧,40,挂牌出让,,10300,,2017,######,######,35279,2.3,81141.7,泰兴市居然之家商业管理有限公司,,,,,,,,,,,,,,######,######
2562,其他商服用地,泰州市,靖江市,商业、商务（华靖资产）,靖江市工农路9号-11号,40,挂牌出让,,1290,,2017,######,######,4682.1,1.96,9176.916,江苏华靖资产经营有限公司,,,,,,,,,,,,,,######,######
2563,商务金融用地,泰州市,靖江市,商务（华靖资产）,靖江市通江路西侧,40,挂牌出让,,1136,,2017,######,######,6325,1.64,10373,江苏华靖资产经营有限公司,,,,,,,,,,,,,,######,######
2565,其他商服用地,泰州市,靖江市,商业、商务、住宅（龙信房地产）,苏源热电路北侧，中圩东路南侧，人民南路西侧，姜八路东侧,70,挂牌出让,,27155,,2017,######,######,117964,1.8,212335.2,龙信房地产（靖江）有限公司,,,,,,,,,,,,,,######,######
2569,街巷用地,泰州市,高港区,田古公路（高港段）,高港区口岸街道城东、集成、田河三村境内,70,划拨,,0,,2017,######,######,77490,1,77490,泰州市交通运输局高港分局,,,,,,,,,,,,,,######,######
2570,街巷用地,泰州市,泰州市本级,南泰路工程,泰州医药高新技术产业开发区寺巷街道二桥、屠桥及南塘三村境内,70,划拨,,0,,2017,######,######,142599,1,142599,泰州华信药业投资有限公司,,,,,,,,,,,,,,######,######
2571,科教用地,泰州市,兴化市,江苏兴达钢帘线股份有限公司工会委员会,兴化市戴南镇迎宾大道西侧、城中河北侧,50,挂牌出让,,383,,2017,######,######,5166.2,1.45,7490.99,江苏兴达钢帘线股份有限公司工会委员会,,,,,,,,,,,,,,######,######
2573,商务金融用地,泰州市,泰州市本级,泰州医药高新区曙光路北侧、会展路西侧,泰州医药高新区曙光路北侧、会展路西侧,40,挂牌出让,,9600,,2017,######,######,35621,3.5,124673.5,泰州通泰投资有限公司,,,,,,,,,,,,,,######,######
2574,商务金融用地,泰州市,泰州市本级,泰州医药高新区会展路西侧、会展1号支路南侧,泰州医药高新区会展路西侧、会展1号支路南侧,40,挂牌出让,,4800,,2017,######,######,17217,5.86,100891.6,泰州通泰投资有限公司,,,,,,,,,,,,,,######,######
2576,商务金融用地,泰州市,泰兴市,江苏润泰工程项目管理咨询有限公司,高新区曾涛路南侧、科太路东侧,40,挂牌出让,,1648,,2017,######,######,5000,3.55,17750,江苏润泰工程项目管理咨询有限公司,,,,,,,,,,,,,,######,######
2596,街巷用地,泰州市,泰州市本级,济川西路（吴州路-祥泰路）,泰州医药高新技术产业开发区寺巷镇春风、新建两村境内,40,划拨,,0,,2017,######,######,60629,1,60629,泰州鑫泰集团有限公司,,,,,,,,,,,,,,######,######
2597,街巷用地,泰州市,泰州市本级,吴洲南路（春风路-济川西路）,泰州医药高新技术产业开发区寺巷镇春风村境内,40,划拨,,0,,2017,######,######,7165,1,7165,泰州鑫泰集团有限公司,,,,,,,,,,,,,,######,######
2598,街巷用地,泰州市,泰州市本级,周山河路（泰高路-南官河）,泰州医药高新技术产业开发区寺巷镇军甫、城南两村境内,40,划拨,,0,,2017,######,######,13496,1,13496,泰州鑫泰集团有限公司,,,,,,,,,,,,,,######,######
2599,街巷用地,泰州市,泰州市本级,吴陵南路（扬子港桥-凤凰西路）,泰州医药高新技术产业开发区寺巷镇殷庄、鲍庄两村境内,40,划拨,,0,,2017,######,######,43422,1,43422,泰州鑫泰集团有限公司,,,,,,,,,,,,,,######,######
2600,科教用地,泰州市,兴化市,中心小学食堂项目,兴化市大邹镇双溪村双园路南,40,划拨,,0,,2017,######,######,1333.3,0.38,506.654,兴化市大邹中心小学,,,,,,,,,,,,,,######,######
2605,商务金融用地,泰州市,兴化市,江苏舍得建设工程有限公司,兴化市兴泰公路西侧、高强路南侧,40,挂牌出让,,547,,2017,######,######,13164.8,0.8,10531.84,江苏舍得建设工程有限公司,,,,,,,,,,,,,,######,######
2607,其他商服用地,泰州市,兴化市,江苏泰汇现代物流股份有限公司,兴化市戴南镇史堡村、雁伦村,40,挂牌出让,,5154,,2017,######,######,131231.6,0.65,85300.54,江苏泰汇现代物流股份有限公司,,,,,,,,,,,,,,######,######
2608,宗教用地,泰州市,泰兴市,泰兴市基督教堂,龙河路北侧、驾培路东侧,40,划拨,,0,,2017,######,######,6667,1.2,8000.4,泰兴市基督教堂,,,,,,,,,,,,,,######,######
2621,科教用地,泰州市,泰州市本级,滨江工作站-特种设备检验研究中心项目,泰州医药高新技术产业开发区沿江街道杨湾、高港两村境内,40,划拨,,0,,2017,######,######,10157,0.91,9242.87,江苏省特种设备安全监督检验研究院,,,,,,,,,,,,,,######,######
2622,商务金融用地,泰州市,海陵区,海陵区青年南路西侧、规划虹桥西街北侧约30米,海陵区青年南路西侧、规划虹桥西街北侧约30米,40,挂牌出让,,2600,,2017,######,######,2943,1.4,4120.2,泰州市鑫通停车场建设管理有限公司,,,,,,,,,,,,,,######,######
2623,科教用地,泰州市,高港区,泰州市刁铺中心幼儿园迁建工程,高港区刁铺街道金港北路西侧,40,划拨,,0,,2017,######,######,10640,0.57,6064.8,泰州市高港区人民政府刁铺街道办事处,,,,,,,,,,,,,,######,######
2626,医卫慈善用地,泰州市,泰兴市,泰兴市妇幼保健院,龙河路北侧、枕淮路西侧,40,划拨,,0,,2017,######,######,18007,1.2,21608.4,泰兴市妇幼保健院,,,,,,,,,,,,,,######,######
2651,批发零售用地,泰州市,泰兴市,江苏双源房地产开发有限公司,黄桥镇金溪路东侧、定慧路西侧,40,挂牌出让,,5398,,2017,######,######,32514.4,1,32514.4,江苏双源房地产开发有限公司,,,,,,,,,,,,,,######,######
2670,街巷用地,泰州市,泰州市本级,春兰路道路用地,凤凰街道振兴村,40,划拨,,0,,2017,######,######,30802,1,30802,泰州市城市基础设施建设发展有限公司,,,,,,,,,,,,,,######,######
2671,街巷用地,泰州市,泰州市本级,吴陵路道路用地,明珠街道鲍庄村、春风村、殷庄村,40,划拨,,0,,2017,######,######,71760,1,71760,泰州鑫泰集团有限公司,,,,,,,,,,,,,,######,######
2672,街巷用地,泰州市,泰州市本级,栖霞山路道路用地,凤凰街道向阳社区、军甫村,40,划拨,,0,,2017,######,######,8712,1,8712,泰州市深业投资发展有限公司,,,,,,,,,,,,,,######,######
2673,街巷用地,泰州市,泰州市本级,黄河路道路用地,寺巷街道军甫村,40,划拨,,0,,2017,######,######,4205,1,4205,泰州市深业投资发展有限公司,,,,,,,,,,,,,,######,######
2674,街巷用地,泰州市,泰州市本级,栖霞山路道路用地,凤凰街道向阳社区、杨庄村、寺巷街道军甫村、石桥村,40,划拨,,0,,2017,######,######,27269,1,27269,泰州市深业投资发展有限公司,,,,,,,,,,,,,,######,######
2675,街巷用地,泰州市,高港区,解放路,刁铺街道,40,划拨,,0,,2017,######,######,16552,1,16552,泰州市港城建设投资发展有限公司,,,,,,,,,,,,,,######,######
2676,街巷用地,泰州市,海陵区,道路,海陵工业园区,40,划拨,,0,,2017,######,######,7455,1,7455,泰州市海陵资产经营有限公司,,,,,,,,,,,,,,######,######
2696,其他商服用地,泰州市,泰兴市,汪小云、季晓平,泰兴市万桥路7号1号楼7-10室,40,协议出让,,9.58,,2017,######,######,22.73,5,113.65,季晓平、汪小云,,,,,,,,,,,,,,######,######
2700,商务金融用地,泰州市,靖江市,商务（滨江公司）,同兴路东侧，府东路南侧,40,挂牌出让,,118,,2017,######,######,525,1.2,630,靖江市滨江新城投资开发有限公司,,,,,,,,,,,,,,######,######
2721,科教用地,泰州市,泰兴市,泰兴市叶利小学,新街镇叶利村刘梧路东侧,40,划拨,,0,,2017,######,######,5370,1.2,6444,泰兴市叶利小学,,,,,,,,,,,,,,######,######
2722,批发零售用地,泰州市,泰兴市,郭广艺,姚王镇泰姚南路,40,协议出让,,2.2,,2017,######,######,19.8,3,59.4,郭广艺,,,,,,,,,,,,,,######,######
2731,商务金融用地,泰州市,海陵区,海陵区人民西路南侧、青年南路西侧约30米,海陵区人民西路南侧、青年南路西侧约30米,40,挂牌出让,,1280,,2017,######,######,1507,2,3014,泰州市鑫通置业有限公司,,,,,,,,,,,,,,######,######
2733,其他商服用地,泰州市,靖江市,商业、商务、居住（盛众置业）,新港城，江平路东侧，东阜路西侧，扒头河南侧，永庆路北侧,70,挂牌出让,,6300,,2017,######,######,86783,1.6,138852.8,江苏盛众置业有限公司,,,,,,,,,,,,,,######,######
2734,商务金融用地,泰州市,泰兴市,江苏泰兴农村商业银行股份有限公司,市区国庆东路北侧、镇海路东侧,40,挂牌出让,,2688,,2017,######,######,20002,1.65,33003.3,江苏泰兴农村商业银行股份有限公司,,,,,,,,,,,,,,######,######
2735,科教用地,泰州市,姜堰市,淤溪小学幼儿园教学楼,淤溪镇淤溪村,40,划拨,,0,,2017,######,######,3921,0.67,2627.07,泰州市姜堰区淤溪中心小学,,,,,,,,,,,,,,######,######
2750,医卫慈善用地,泰州市,靖江市,靖江市季市镇季市中心卫生院,靖江市季市镇季市村、季新村,40,划拨,,0,,2017,######,######,20333,1.11,22569.63,靖江市季市镇季市中心卫生院,,,,,,,,,,,,,,######,######
2754,批发零售用地,泰州市,泰兴市,顾桂青、鲍建林,泰兴市古溪镇私盐路东侧,40,协议出让,,4.58,,2017,######,######,34,4,136,顾桂青、鲍建林,,,,,,,,,,,,,,######,######
2755,机关团体用地,泰州市,泰兴市,江苏省泰兴虹桥工业园区管理委员会,虹桥园区府后路北侧,40,划拨,,0,,2017,######,######,2671,1.2,3205.2,江苏省泰兴虹桥工业园区管理委员会,,,,,,,,,,,,,,######,######
2756,机关团体用地,泰州市,泰兴市,江苏省泰兴虹桥工业园区管理委员会,虹桥园区府后路北侧,40,划拨,,0,,2017,######,######,5880,1.2,7056,江苏省虹桥工业园区管理委员会,,,,,,,,,,,,,,######,######
2758,医卫慈善用地,泰州市,靖江市,靖江市离退休人员疗养康复中心,靖江市横港南路92号,40,协议出让,,499,,2017,######,######,4431,1.5,6646.5,靖江市离退休人员疗养康复中心,,,,,,,,,,,,,,######,######
2759,商务金融用地,泰州市,泰兴市,江苏大隆鑫建筑工程有限公司,黄桥镇金溪路东侧、东华村路北侧,40,挂牌出让,,647,,2017,######,######,6221,2.35,14619.35,江苏大隆鑫建筑工程有限公司,,,,,,,,,,,,,,######,######
2771,街巷用地,泰州市,海陵区,引凤路西侧地下停车场,引凤路西侧、静安路南侧,50,协议出让,,1350,,2017,######,######,24408,0.01,244.08,泰州市鑫通停车场建设管理有限公司,,,,,,,,,,,,,,######,######
2772,街巷用地,泰州市,海陵区,东进东路南侧地下停车场,东进东路南侧、关帝庙西侧,50,协议出让,,70,,2017,######,######,1113,0.01,11.13,泰州市鑫通停车场建设管理有限公司,,,,,,,,,,,,,,######,######
2773,街巷用地,泰州市,海陵区,鼓楼南路污水泵站南侧地下停车场,鼓楼路东侧、污水泵站南侧,50,协议出让,,200,,2017,######,######,3502,0.01,35.02,泰州市鑫通停车场建设管理有限公司,,,,,,,,,,,,,,######,######
2774,医卫慈善用地,泰州市,泰兴市,泰兴市中医院,济川街道办科技路西侧、龙河路北侧,50,划拨,,0,,2017,######,######,53333,1.2,63999.6,泰兴市中医院,,,,,,,,,,,,,,######,######
2777,科教用地,泰州市,靖江市,靖江市教育局,西来镇泥桥村,50,划拨,,0,,2017,######,######,6733,2,13466,靖江市教育局,,,,,,,,,,,,,,######,######
2784,科教用地,泰州市,靖江市,靖江市教育局,斜桥镇斜桥村,50,划拨,,0,,2017,######,######,20126,1.5,30189,靖江市教育局,,,,,,,,,,,,,,######,######
2834,批发零售用地,泰州市,姜堰市,泰州金迪汽车销售服务有限公司,姜堰经济开发区开阳路南侧、华东汽车城区间路东侧,40,挂牌出让,,436,,2017,######,######,3632,1.5,5448,泰州金迪汽车销售服务有限公司,,,,,,,,,,,,,,######,######
2837,科教用地,泰州市,靖江市,幼托用地（江鸿臻）,同安路西侧，望江路北侧,40,挂牌出让,,2906,,2017,######,######,22794,1.2,27352.8,江鸿臻,,,,,,,,,,,,,,######,######
2838,其他商服用地,泰州市,靖江市,商业、商务（供销房地产）,江平路南侧，城西大道东侧,40,挂牌出让,,744,,2017,######,######,4275,2.6,11115,靖江市供销房地产发展有限公司,,,,,,,,,,,,,,######,######
2841,其他商服用地,泰州市,靖江市,商业、商务（滨江公司）,城东大道西侧，新洲路南侧，望江路北侧,40,挂牌出让,,6130,,2017,######,######,27234,1.2,32680.8,靖江市滨江新城投资开发有限公司,,,,,,,,,,,,,,######,######
2842,住宿餐饮用地,泰州市,泰兴市,江苏康梦尔大酒店有限公司,农产品园区粮油路东侧、纬二路南侧,40,挂牌出让,,995,,2017,######,######,10606,2,21212,江苏康梦尔大酒店有限公司,,,,,,,,,,,,,,######,######
2845,批发零售用地,泰州市,泰兴市,中农批畜禽交易市场有限公司,农产品园区古高公路南侧、双丁路西侧,40,挂牌出让,,12113,,2017,######,######,230614,1.1,253675.4,中农批畜禽交易市场有限公司,,,,,,,,,,,,,,######,######
2850,其他商服用地,泰州市,靖江市,商住（碧桂园）,新洲路南侧，通江路东侧，望江路北侧,70,挂牌出让,,56160,,2017,######,######,86554,1.8,155797.2,靖江市碧桂园房地产开发有限公司,,,,,,,,,,,,,,######,######
2864,其他商服用地,泰州市,兴化市,太平道合兴化商业发展有限公司,兴化市高兴东公路北侧、东环路东侧、莲溪路西侧,40,挂牌出让,,16130,,2017,######,######,102190.3,2,204380.6,太平道合兴化商业发展有限公司,,,,,,,,,,,,,,######,######
2872,机关团体用地,泰州市,泰州市本级,市救助管理站市救灾物资储备库建设项目,泰州市农业开发区棉花原种场,40,划拨,,0,,2017,######,######,11499,0.67,7704.33,江苏省现代农业开发区资产投资管理中心,,,,,,,,,,,,,,######,######
2876,住宿餐饮用地,泰州市,兴化市,陈世江,兴化市荻垛镇幸福路北侧,40,挂牌出让,,137,,2017,######,######,712.9,1.66,1183.414,陈世江,,,,,,,,,,,,,,######,######
