1341,批发零售用地,泰州市,海陵区,海陵区莲花1号区37幢（1）-（3）轴西侧,海陵区莲花1号区37幢（1）-（3）轴西侧,40,协议出让,,38.09,,2018,2018年11,######,102.5,1.94,198.85,刘宇,,,,,,,,,,,,,,######,######
1342,批发零售用地,泰州市,泰兴市,江苏金泰堡机械制造有限公司,宣堡镇建工路北侧,40,挂牌出让,,405,,2018,2018年11,######,3806,2,7612,江苏金泰堡机械制造有限公司,,,,,,,,,,,,,,######,######
1345,科教用地,泰州市,海陵区,现代农牧业开放性公共技能实训基地建设项目,泰州市红旗良种场范围内,40,划拨,,0,,2018,2018年11,######,13159,0.72,9474.48,江苏农牧科技职业学院,,,,,,,,,,,,,,######,######
1352,科教用地,泰州市,姜堰市,姜堰区文化与体育设施项目（区委党校新校区）,罗塘街道城北村,40,划拨,,0,,2018,2018年11,######,31876,1.04,33151.04,泰州市姜堰区体育局,,,,,,,,,,,,,,######,######
1362,科教用地,泰州市,海陵区,海陵幼儿园,城西街道森南社区、闸西社区范围内,40,划拨,,0,,2018,2018年11,######,12886,0.68,8762.48,泰州市海陵区教育局,,,,,,,,,,,,,,######,######
1363,医卫慈善用地,泰州市,海陵区,鑫龙社区服务中心项目,海陵区城南街道鑫龙家园范围内,40,划拨,,0,,2018,2018年11,######,2102,0.36,756.72,泰州市海陵区人民政府城南街道办事处,,,,,,,,,,,,,,######,######
1384,住宿餐饮用地,泰州市,泰兴市,张晓健,黄桥镇东进西路南侧、金溪路东侧,40,挂牌出让,,1145,,2018,2018年10,######,8508,1.6,13612.8,张晓健,,,,,,,,,,,,,,######,######
1385,住宿餐饮用地,泰州市,兴化市,兴化市中江商务酒店,兴化市竹泓镇创业路南侧,40,挂牌出让,,79,,2018,2018年10,######,1005.4,1.95,1960.53,兴化市中江商务酒店,,,,,,,,,,,,,,######,######
1398,其他商服用地,泰州市,兴化市,兴化市新城液化气站,城区兴西路东侧、关城路北侧,40,挂牌出让,,560,,2018,2018年10,######,7074.8,0.4,2829.92,兴化市新城液化气站,,,,,,,,,,,,,,######,######
1428,批发零售用地,泰州市,泰兴市,泰兴市智光环保科技有限公司,高新区环溪路南侧、科新路西侧,40,挂牌出让,,10385,,2018,2018年10,######,63970,2,127940,泰兴市智光环保科技有限公司,,,,,,,,,,,,,,######,######
1429,医卫慈善用地,泰州市,泰兴市,唐风翠,根思乡宣泰公路东侧,50,挂牌出让,,100,,2018,2018年10,######,1856,1.2,2227.2,唐风翠,,,,,,,,,,,,,,######,######
1442,批发零售用地,泰州市,兴化市,兴化市城市建设投资有限公司,城区文峰路东侧、文昌路南侧,40,挂牌出让,,10930,,2018,2018年10,######,32765.7,2.05,67169.69,兴化市城市建设投资有限公司,,,,,,,,,,,,,,######,######
1462,医卫慈善用地,泰州市,泰兴市,江苏永兴生态农牧发展有限公司,河失镇同心村334省道南侧,40,划拨,,0,,2018,2018年10,######,16559,1.2,19870.8,江苏永兴生态农牧发展有限公司,,,,,,,,,,,,,,######,######
1470,商务金融用地,泰州市,姜堰市,泰州兴联房地产开发有限公司,姜堰区变电所路南侧、幸福路东侧,40,挂牌出让,,961,,2018,######,######,2743,1.4,3840.2,泰州兴联房地产开发有限公司,,,,,,,,,,,,,,######,######
1481,街巷用地,泰州市,海陵区,龙扬路（九里桥路-京泰路）建设工程,海陵区京泰路街道新周桥、双墩社区，苏陈镇西石羊社区境内,40,划拨,,0,,2018,######,######,10084,1,10084,泰州市泰政交通投资有限公司,,,,,,,,,,,,,,######,######
1482,街巷用地,泰州市,海陵区,金东路（双墩路-海姜大道）建设工程,海陵区京泰路街道新周桥、双墩社区境内,40,划拨,,0,,2018,######,######,25653,1,25653,泰州市泰政交通投资有限公司,,,,,,,,,,,,,,######,######
1483,街巷用地,泰州市,海陵区,九里桥路（龙扬路-运河路）建设工程,海陵区双墩社区境内,40,划拨,,0,,2018,######,######,15176,1,15176,泰州市泰政交通投资有限公司,,,,,,,,,,,,,,######,######
1484,街巷用地,泰州市,海陵区,龙汇路（站前路-京泰路）建设工程,海陵区京泰路街道新周桥、双墩社区，苏陈镇西石羊社区境内,40,划拨,,0,,2018,######,######,21690,1,21690,泰州市泰政交通投资有限公司,,,,,,,,,,,,,,######,######
1493,批发零售用地,泰州市,姜堰市,中国石化销售有限公司江苏泰州石油分公司,姜堰区353省道南侧、阜兴泰高速西侧,40,挂牌出让,,329,,2018,######,######,3210,1,3210,中国石化销售有限公司江苏泰州石油分公司,,,,,,,,,,,,,,######,######
1506,批发零售用地,泰州市,海陵区,海光三期营业用房106#,海光三期营业用房106#,40,协议出让,,4.9817,,2018,######,######,19.8,0.96,19.008,赵先应,,,,,,,,,,,,,,######,######
1509,街巷用地,泰州市,姜堰市,三水华府东侧停车场,罗塘街道西桥村,40,划拨,,0,,2018,######,######,2811,1,2811,泰州市姜堰城市建设投资发展有限公司,,,,,,,,,,,,,,######,######
1513,商务金融用地,泰州市,海陵区,海陵区京泰路西侧、规划海阳路南侧,海陵区京泰路西侧、规划海阳路南侧,40,挂牌出让,,98800,,2018,######,######,87806,3,263418,泰州市泰政交通投资有限公司,,,,,,,,,,,,,,######,######
1516,医卫慈善用地,泰州市,姜堰市,泰州市姜堰太宇医院项目,罗塘街道唐园村,50,协议出让,,2076.16,,2018,######,######,37054,1,37054,泰州市姜堰太宇医院,,,,,,,,,,,,,,######,######
1526,科教用地,泰州市,泰兴市,泰兴市黄桥镇启乐幼儿园,黄桥镇军民路南侧吴韩家园,40,划拨,,0,,2018,######,######,5111,1.2,6133.2,泰兴市黄桥镇启乐幼儿园,,,,,,,,,,,,,,######,######
1527,批发零售用地,泰州市,海陵区,莲花1号小区B1（11-12）轴,海陵区莲花1号小区B1（11-12）轴,40,协议出让,,53.48,,2018,######,######,87,2.27,197.49,李明和汤桂凤,,,,,,,,,,,,,,######,######
1529,街巷用地,泰州市,姜堰市,滨河路道路建设项目,罗塘街道城区,40,划拨,,0,,2018,######,######,3099,1,3099,泰州市姜堰城市建设投资发展有限公司,,,,,,,,,,,,,,######,######
1530,科教用地,泰州市,兴化市,周庄镇中心幼儿园建设项目,周庄镇创业路东侧、友谊路南侧,40,划拨,,0,,2018,######,######,8030,0.61,4898.3,兴化市周庄镇中心幼儿园,,,,,,,,,,,,,,######,######
1543,其他商服用地,泰州市,靖江市,商业（泰元文化传媒）,生祠镇金星村,40,挂牌出让,,4700,,2018,######,######,52013,1.6,83220.8,泰元文化传媒（靖江）有限公司,,,,,,,,,,,,,,######,######
1594,其他商服用地,泰州市,靖江市,商业、商务（手拉手汽车小镇）,车管路南侧，联泰路东侧,40,挂牌出让,,4000,,2018,######,######,31256,1.5,46884,靖江手拉手汽车小镇开发有限公司,,,,,,,,,,,,,,######,######
1595,其他商服用地,泰州市,靖江市,商业、商务（手拉手汽车小镇）,车管路南侧，联泰路东侧,40,挂牌出让,,3770,,2018,######,######,29401,1.5,44101.5,靖江手拉手汽车小镇开发有限公司,,,,,,,,,,,,,,######,######
1642,机关团体用地,泰州市,泰兴市,泰兴市张桥镇人民政府,张桥镇江平公路西侧,40,划拨,,0,,2018,######,######,1740,1.2,2088,泰兴市张桥镇人民政府,,,,,,,,,,,,,,######,######
1643,科教用地,泰州市,泰兴市,泰兴市实验初级中学,济川街道澄江路北侧、济川路西侧,40,划拨,,0,,2018,######,######,54014,1.2,64816.8,泰兴市实验初级中学,,,,,,,,,,,,,,######,######
1650,监教场所用地,泰州市,海陵区,泰州市看守所,泰州市农业开发区红旗良种场境内,40,划拨,,0,,2018,######,######,58815,0.38,22349.7,泰州市公安局,,,,,,,,,,,,,,######,######
1651,科教用地,泰州市,海陵区,泰州市人民警察培训学校,泰州市农业开发区红旗良种场境内,40,划拨,,0,,2018,######,######,34461,0.66,22744.26,泰州市公安局,,,,,,,,,,,,,,######,######
1652,街巷用地,泰州市,海陵区,人民东路南延（南山寺路-迎春东路）工程,海陵区城中街道文昌社区境内,40,划拨,,0,,2018,######,######,5004,1,5004,泰州市城市基础设施建设发展有限公司,,,,,,,,,,,,,,######,######
1653,街巷用地,泰州市,泰州市本级,钟山路,泰州医药高新区凤凰街道向阳社区、寺巷街道军甫社区、石桥社区、杨庄社区境内,40,划拨,,0,,2018,######,######,21591,1,21591,泰州市新开城建项目投资管理有限公司,,,,,,,,,,,,,,######,######
1654,医卫慈善用地,泰州市,海陵区,招贤社区便民服务中心项目,泰州市海陵区城西街道招贤社区境内,40,划拨,,0,,2018,######,######,1543,1.01,1558.43,泰州市海陵区招贤社区居民委员会,,,,,,,,,,,,,,######,######
1655,科教用地,泰州市,靖江市,(实验学校城北分校)靖江市北辰城乡投资建设有限公司,孤山镇常胜村,40,划拨,,0,,2018,######,######,48232,0.6,28939.2,靖江市北辰城乡投资建设有限公司,,,,,,,,,,,,,,######,######
1679,科教用地,泰州市,泰兴市,泰兴市新街镇梅鞠幼儿园,新街镇南新街村南新三组,50,挂牌出让,,198,,2018,######,######,3810,0.8,3048,泰兴市新街镇梅鞠幼儿园,,,,,,,,,,,,,,######,######
1695,住宿餐饮用地,泰州市,兴化市,朱义富,兴化市陈堡镇兴泰公路东侧,40,挂牌出让,,256,,2018,######,######,3112,2.5,7780,朱义富,,,,,,,,,,,,,,######,######
1698,街巷用地,泰州市,泰州市本级,东谢路和银杏北路项目,泰州医药高新区凤凰街道东谢村境内,40,划拨,,0,,2018,######,######,15664,1,15664,泰州市新开城建项目投资管理有限公司,,,,,,,,,,,,,,######,######
1701,医卫慈善用地,泰州市,兴化市,竹泓镇卫生院迁建项目,竹泓镇创业西路南侧,40,划拨,,0,,2018,######,######,3129.5,1.12,3505.04,兴化市竹泓镇卫生院,,,,,,,,,,,,,,######,######
1702,科教用地,泰州市,兴化市,新区高级中学新建工程,垛田镇张庄路东侧、高兴东北、站前南路南,40,划拨,,0,,2018,######,######,212782.9,0.89,189376.8,江苏省兴化中学,,,,,,,,,,,,,,######,######
1703,机关团体用地,泰州市,兴化市,泰州市公安局交通警察支队高速公路四大队业务用房工程,大垛镇盐靖高速公路兴化收费站西北侧,40,划拨,,0,,2018,######,######,6677,0.72,4807.44,泰州市公安局,,,,,,,,,,,,,,######,######
1709,机关团体用地,泰州市,泰兴市,泰兴市水政监察大队,虹桥镇江堤路东侧,40,划拨,,0,,2018,######,######,5392,1.2,6470.4,泰兴市水政监察大队,,,,,,,,,,,,,,######,######
1710,机关团体用地,泰州市,泰兴市,泰兴市公安局,济川街道荷花池巷4号,50,协议出让,,180.75,,2018,######,######,667.71,2,1335.42,泰兴市公安局,,,,,,,,,,,,,,######,######
1725,宗教用地,泰州市,泰兴市,泰兴市大马庄基督教活动点,滨江镇大马庄村江平路东侧,40,划拨,,0,,2018,######,######,2563,1.2,3075.6,泰兴市滨江镇大马庄基督教活动点,,,,,,,,,,,,,,######,######
1726,科教用地,泰州市,姜堰市,泰州易华录数据湖信息技术有限公司,罗塘街道殷家村,50,挂牌出让,,3802.7,,2018,######,######,126757,1.8,228162.6,泰州易华录数据湖信息技术有限公司,,,,,,,,,,,,,,######,######
1735,机关团体用地,泰州市,泰兴市,泰兴市市场监督管理局,济川街道国庆东路北侧,50,协议出让,,530.35,,2018,######,######,2542.42,2,5084.84,泰兴市市场监督管理局,,,,,,,,,,,,,,######,######
1737,医卫慈善用地,泰州市,泰兴市,泰兴市康泰医药化工有限公司,河失镇城黄公路南侧,,划拨,,0,,2018,######,######,6667,1.2,8000.4,泰兴市康泰医药化工有限公司,,,,,,,,,,,,,,######,######
1738,街巷用地,泰州市,高港区,高港区口岸街道港城东路南侧、扬子江路西侧地块（地下部分）,高港区港城东路南侧、扬子江路西侧,50,协议出让,,430,,2018,######,######,8018,0.01,80.18,泰州市港城资产投资管理有限公司,,,,,,,,,,,,,,######,######
1739,批发零售用地,泰州市,泰兴市,泰州天旭达汽车贸易有限公司,银杏路南侧、镇海路东侧6号地块,40,挂牌出让,,2015,,2018,######,######,15555,1.5,23332.5,泰兴天旭达汽车贸易有限公司,,,,,,,,,,,,,,######,######
1744,殡葬用地,泰州市,泰兴市,泰兴市殡仪馆,济川街道宁通高速东侧、新蔡港河南侧,,划拨,,0,,2018,######,######,33311,1.2,39973.2,泰兴市殡仪馆,,,,,,,,,,,,,,######,######
1745,批发零售用地,泰州市,泰兴市,袁沪,银杏路南侧、镇海路东侧5号地块,40,挂牌出让,,1606,,2018,######,######,12355,1.5,18532.5,袁沪,,,,,,,,,,,,,,######,######
1746,住宿餐饮用地,泰州市,兴化市,泰州市长九房地产开发有限公司,兴化市长安南路东侧、文昌路南侧、城南路北侧,70,挂牌出让,,46200,,2018,######,######,103011,2.2,226624.2,泰州市长九房地产开发有限公司,,,,,,,,,,,,,,######,######
1747,批发零售用地,泰州市,泰兴市,泰兴市鑫宇汽车销售服务有限公司,银杏路南侧、镇海路东侧4号地块,40,挂牌出让,,1231,,2018,######,######,6400,1.5,9600,泰兴市鑫宇汽车销售服务有限公司,,,,,,,,,,,,,,######,######
1756,科教用地,泰州市,兴化市,中心幼儿园迁址新建,竹泓镇创业西路北侧,40,划拨,,0,,2018,######,######,4400,0.95,4180,兴化市竹泓镇人民政府,,,,,,,,,,,,,,######,######
1757,科教用地,泰州市,高港区,泰州市孔桥实验学校建设项目,高港区许庄街道孔桥社区境内,40,划拨,,0,,2018,######,######,48371,0.71,34343.41,泰州市高港区人民政府许庄街道办事处,,,,,,,,,,,,,,######,######
1768,机关团体用地,泰州市,兴化市,兴化市安丰镇社会治理综合服务中心,安丰镇宁靖盐（S299）公路西侧莲花段,40,划拨,,0,,2018,######,######,7726.6,0.6,4635.96,兴化市安丰镇人民政府,,,,,,,,,,,,,,######,######
1769,机关团体用地,泰州市,兴化市,西郊派出所新建工程,西郊镇丁沙村中沙兴横公路北侧,40,划拨,,0,,2018,######,######,2947.1,0.48,1414.608,兴化市西郊镇人民政府,,,,,,,,,,,,,,######,######
1770,住宿餐饮用地,泰州市,泰州市本级,泰州医药高新区鼓楼南路东侧、规划海河路北侧,泰州医药高新区鼓楼南路东侧、规划海河路北侧,40,挂牌出让,,76700,,2018,######,######,136431,0.4,54572.4,泰州市建业酒店管理有限公司,,,,,,,,,,,,,,######,######
1771,批发零售用地,泰州市,泰州市本级,泰州医药高新区健康大道南侧、三桥变电所西侧约35米,泰州医药高新区健康大道南侧、三桥变电所西侧约35米,40,挂牌出让,,11050,,2018,######,######,3890,0.6,2334,中国石化销售有限公司江苏泰州石油分公司,,,,,,,,,,,,,,######,######
1772,商务金融用地,泰州市,泰州市本级,泰州医药高新区会展1号支路南侧、6号支路西侧,泰州医药高新区会展1号支路南侧、6号支路西侧,40,挂牌出让,,3200,,2018,######,######,11461,4.02,46073.22,泰州医药高新技术产业投资发展有限公司,,,,,,,,,,,,,,######,######
1781,批发零售用地,泰州市,泰兴市,朱建章,泰兴市万福小区2#楼7#门面房,40,协议出让,,26.24,,2018,######,######,46.11,2,92.22,朱建章,,,,,,,,,,,,,,######,######
1795,街巷用地,泰州市,海陵区,环卫车队停车场项目,京泰路街道东唐社区、许郑社区境内,40,划拨,,0,,2018,######,######,36397,0.4,14558.8,泰州市环境卫生管理处,,,,,,,,,,,,,,######,######
1796,街巷用地,泰州市,海陵区,东林路、海润路接通工程,城西街道闸西社区境内,40,划拨,,0,,2018,######,######,11644,1,11644,泰州市城市基础设施建设发展有限公司,,,,,,,,,,,,,,######,######
1797,科教用地,泰州市,泰兴市,泰兴市横垛初级中学,古溪镇横垛社区文化路东忘年交、横垛路南侧,40,划拨,,0,,2018,######,######,6599,1.2,7918.8,泰兴市横垛初级中学,,,,,,,,,,,,,,######,######
1798,其他商服用地,泰州市,靖江市,商业（滨江公司）,府西路北侧、晨阳路东侧,40,挂牌出让,,40000,,2018,######,######,43886,1.8,78994.8,靖江市滨江新城投资开发有限公司,,,,,,,,,,,,,,######,######
1803,其他商服用地,泰州市,姜堰市,陈斌,二布厂东路西侧、长江路北侧,40,挂牌出让,,2166,,2018,######,######,5112,1.2,6134.4,陈斌,,,,,,,,,,,,,,######,######
1810,其他商服用地,泰州市,靖江市,徐宏,人民南路东侧，朝阳路南侧,40,挂牌出让,,3500,,2018,######,######,6667,1.5,10000.5,徐宏,,,,,,,,,,,,,,######,######
1812,其他商服用地,泰州市,靖江市,商务（靖江市城乡建设有限公司）,城西大道东侧，东进路北侧，七圩港西路西侧,40,挂牌出让,,9360,,2018,######,######,13896,2,27792,靖江市城乡建设有限公司,,,,,,,,,,,,,,######,######
1813,其他商服用地,泰州市,靖江市,江苏华靖资产经营有限公司,站前路西侧，工农路北侧,40,挂牌出让,,9700,,2018,######,######,32393,1.2,38871.6,江苏华靖资产经营有限公司,,,,,,,,,,,,,,######,######
1814,其他商服用地,泰州市,靖江市,靖江市国际汽贸城开发有限公司,中洲西路南侧,40,挂牌出让,,1390,,2018,######,######,9665,1.8,17397,靖江市国际汽贸城开发有限公司,,,,,,,,,,,,,,######,######
1815,医卫慈善用地,泰州市,泰兴市,泰兴市金三角老年公寓,济川街道迎幸村金沙中沟路西侧,40,划拨,,0,,2018,######,######,5227,1.2,6272.4,泰兴市金三角老年公寓,,,,,,,,,,,,,,######,######
1824,商务金融用地,泰州市,泰州市本级,泰州医药高新区康居路北侧、老前进河西侧约35米,泰州医药高新区康居路北侧、老前进河西侧约35米,40,挂牌出让,,730,,2018,######,######,3107,2.14,6648.98,泰州华信药业投资有限公司,,,,,,,,,,,,,,######,######
1825,商务金融用地,泰州市,泰州市本级,泰州医药高新区春晖路东侧约150米、康居路北侧,泰州医药高新区春晖路东侧约150米、康居路北侧,40,挂牌出让,,630,,2018,######,######,2574,2.18,5611.32,泰州华信药业投资有限公司,,,,,,,,,,,,,,######,######
1826,街巷用地,泰州市,高港区,绿化及道路用地,高港区口岸街道大石、城南、东南、新明四社区境内,40,划拨,,0,,2018,######,######,260441,1,260441,江苏临港经济园投资开发有限公司,,,,,,,,,,,,,,######,######
1827,街巷用地,泰州市,高港区,绿化及道路用地,高港区刁铺街道环溪社区、通太社区、关桥社区、口岸街道王营社区、城东社区、新明社区、龙窝口社区、城南社区、蔡滩社区、朱营社区、许庄社区及永安洲镇上桥社区境内,40,划拨,,0,,2018,######,######,254403,1,254403,泰州市港城建设投资发展有限公司,,,,,,,,,,,,,,######,######
1829,街巷用地,泰州市,高港区,道路及绿化用地,永安洲镇永兴社区，永胜社区、建安社区、东江社区、中心社区及口岸街道郎庄社区,40,划拨,,0,,2018,######,######,269245,1,269245,江苏泰州港核心港区投资有限公司,,,,,,,,,,,,,,######,######
1837,住宿餐饮用地,泰州市,兴化市,兴化市恒川酒店有限公司,兴化市李中镇兴健村、翟家村、顾一路东侧,40,挂牌出让,,195,,2018,######,######,3938,1.5,5907,兴化市恒川酒店有限公司,,,,,,,,,,,,,,######,######
1872,科教用地,泰州市,兴化市,新城幼儿园分园新建工程,荡南路南侧、九顷北路西侧,40,划拨,,0,,2018,######,######,4955,1,4955,兴化市新城幼儿园,,,,,,,,,,,,,,######,######
1884,批发零售用地,泰州市,姜堰市,江苏隽逸石油投资有限公司-加油站,开发区陈庄路南侧,40,挂牌出让,,285,,2018,######,######,2658,1,2658,江苏隽逸石油投资有限公司,,,,,,,,,,,,,,######,######
1891,批发零售用地,泰州市,泰兴市,胡增华,黄桥镇金溪路东侧、银杏路南侧,70,挂牌出让,,29018,,2018,######,######,111359,1.8,200446.2,胡增华,,,,,,,,,,,,,,######,######
1892,科教用地,泰州市,姜堰市,王小芹、许双泉、江宝祥、刘国太,二布厂路南侧、纵十三路东侧,40,挂牌出让,,2738,,2018,######,######,13311,1.2,15973.2,王小芹、许双泉、江宝祥、刘国太,,,,,,,,,,,,,,######,######
1895,商务金融用地,泰州市,泰兴市,江苏泰兴农村商业银行股份有限公司,张桥镇江平公路西侧,40,挂牌出让,,72,,2018,######,######,658,1.5,987,江苏泰兴农村商业银行股份有限公司,,,,,,,,,,,,,,######,######
1897,医卫慈善用地,泰州市,海陵区,北马社区用房及居家养老服务中心工程,海陵工业园区北马社区,40,划拨,,0,,2018,######,######,2456,2.25,5526,泰州市海陵区北马社区居民委员会,,,,,,,,,,,,,,######,######
1902,批发零售用地,泰州市,泰兴市,泰兴市北新供销合作社,新街镇朝阳西街北侧,40,协议出让,,133.28,,2018,######,######,2298,3,6894,泰兴市北新供销合作社,,,,,,,,,,,,,,######,######
1903,其他商服用地,泰州市,泰兴市,中国建设银行股份有限公司泰兴支行,泰兴市蒋华振华路,40,协议出让,,129.3251,,2018,######,######,1831.8,1.2,2198.16,中国建设银行股份有限公司泰兴支行,,,,,,,,,,,,,,######,######
1904,医卫慈善用地,泰州市,泰兴市,泰州腾欣农业科技有限公司,分界镇腾兴村,40,划拨,,0,,2018,######,######,2000,1.2,2400,泰州腾欣农业科技有限公司,,,,,,,,,,,,,,######,######
1905,科教用地,泰州市,泰兴市,泰兴市育红幼儿园,济川街道文江路西侧、运河路北侧,40,划拨,,0,,2018,######,######,12000,1.2,14400,泰兴市育红幼儿园,,,,,,,,,,,,,,######,######
1924,科教用地,泰州市,高港区,许庄中心小学扩建项目,高港区许庄街道马厂社区境内,40,划拨,,0,,2018,######,######,36111,0.72,25999.92,泰州市高港区人民政府许庄街道办事处,,,,,,,,,,,,,,######,######
1925,街巷用地,泰州市,海陵区,泰州市火车站街区五条支路建设工程,海陵区京泰路街道双墩、周桥两村及苏陈镇西石羊村境内,40,划拨,,0,,2018,######,######,45720,1,45720,泰州市泰政交通投资有限公司,,,,,,,,,,,,,,######,######
1927,机关团体用地,泰州市,兴化市,兴化市大营镇社会管理服务中心,大营镇友谊路西侧,40,划拨,,0,,2018,######,######,5322.5,0.49,2608.025,兴化市大营镇人民政府,,,,,,,,,,,,,,######,######
1956,商务金融用地,泰州市,泰兴市,泰兴市济川街道房地产管理所,泰兴市鼓楼西路231号西侧,40,协议出让,,399.15,,2018,######,######,908.6,3,2725.8,泰兴市济川街道房地产管理所,,,,,,,,,,,,,,######,######
1957,新闻出版用地,泰州市,泰兴市,泰兴市广播电视网络传输有限公司,泰兴市济川路81号,50,协议出让,,868.69,,2018,######,######,6091.8,1.2,7310.16,泰兴市广播电视网络传输有限公司,,,,,,,,,,,,,,######,######
1958,机关团体用地,泰州市,泰兴市,泰兴市财政局,国庆东路12号,50,协议出让,,625.66,,2018,######,######,2546.42,3,7639.26,泰兴市财政局,,,,,,,,,,,,,,######,######
1960,机关团体用地,泰州市,泰兴市,泰兴市中兴国有资产经营投资有限公司,国庆西路南侧,50,协议出让,,373.3,,2018,######,######,2038.75,1.2,2446.5,泰兴市中兴国有资产经营投资有限公司,,,,,,,,,,,,,,######,######
1961,机关团体用地,泰州市,泰兴市,泰兴市房产管理局,长征路东侧、国庆路北侧,50,协议出让,,231.34,,2018,######,######,909,3,2727,泰兴市财政局,,,,,,,,,,,,,,######,######
1964,商务金融用地,泰州市,泰兴市,泰兴市新睿科技有限公司,农产品园区粮油路东侧地块,40,挂牌出让,,1080,,2018,######,######,16016,1.2,19219.2,泰兴市新睿科技有限公司,,,,,,,,,,,,,,######,######
1966,街巷用地,泰州市,兴化市,兴化市戴南不锈钢现代物流园城北大道工程项目,兴化市戴南镇史堡村、雁伦村,40,划拨,,0,,2018,######,######,20871.8,1,20871.8,兴化市东南城市建设投资有限公司,,,,,,,,,,,,,,######,######
1968,批发零售用地,泰州市,泰兴市,泰兴市清源水利建设有限公司,济川路西侧、同德路南侧,40,挂牌出让,,28458,,2018,######,######,31565,3.5,110477.5,泰兴市清源水利建设有限公司,,,,,,,,,,,,,,######,######
1969,批发零售用地,泰州市,泰兴市,泰兴市清源水利建设有限公司,文江路西侧、同德路南侧,40,挂牌出让,,87638,,2018,######,######,97318,3.5,340613,泰兴市清源水利建设有限公司,,,,,,,,,,,,,,######,######
1970,批发零售用地,泰州市,泰兴市,泰兴市清源水利建设有限公司,文江路东侧、同德路南侧,40,挂牌出让,,22638,,2018,######,######,25099,3.5,87846.5,泰兴市清源水利建设有限公司,,,,,,,,,,,,,,######,######
1971,商务金融用地,泰州市,泰兴市,泰兴市智光环保科技有限公司,高新区科创路东侧、凤栖路北侧,40,挂牌出让,,2616,,2018,######,######,19340,2.2,42548,泰兴市智光环保科技有限公司,,,,,,,,,,,,,,######,######
1972,商务金融用地,泰州市,泰兴市,江苏泰丰化工有限公司,虹桥镇江城大道北侧、飞虹路东侧地块,40,挂牌出让,,1840,,2018,######,######,23315,1.2,27978,江苏泰丰化工有限公司,,,,,,,,,,,,,,######,######
1973,商务金融用地,泰州市,泰兴市,泰兴市智光环保科技有限公司,高新区科创路东侧、文昌东路南侧,40,挂牌出让,,14535,,2018,######,######,81827,3,245481,泰兴市智光环保科技有限公司,,,,,,,,,,,,,,######,######
1987,批发零售用地,泰州市,海陵区,海陵区税务桥东街地块,海陵区税务桥东街27号14室,40,协议出让,,20.2708,,2018,######,######,15.5,2.85,44.175,许炳华、刘桂珍、许炳森、陆涛、许炳英、马和生、孙健,,,,,,,,,,,,,,######,######
